"id","text_only"
825817598025728002,"Hay que ser coherentes nada"
813822648404713472,"bienestar energa que puede darme xdistn Cuenca Ecuador"
843897358966538241,"Conector Cat Unidades"
836080574251024385,"very proud one wants someone like that for his life"
818501907056590848,"donde deje barba"
837114350360006657,"Trump anunci ayer comenzara construccin del muro pero solo tiene los xdistllones necesita"
819615900424929281,"Corbata maosa"
837441216090361856,"Happy birthday Tanishaa wish you the Best the World Greetings from Per"
837626163799420928,"saludos lluvia macas morona santiago"
822811959674499073,"the posing for picture"
778094724246888448,"Demasiado tarde"
822090117556895744,"Desbloqueamos iPhone ATampT mejor precio del mercado Todos los modelos son soportados"
818558924647464960,"Hola podran poner por favor"
828453813782716417,"Amaranta Graciela sus aitos celebr con sus amigos sus abuelitos con"
773673776387133442,"Alguien debe sentir que dieron trompa bien dado recomiendo humildocimina general generalsimo"
765303785061220354,"Porque Combate Bacn"
819327733461225473,"jauregui polo norte"
761802644369399808,"GRACIASCON ESTA DESPIDO"
774039235036848128,"Guayaquil Ecuador"
835632138401742848,"quieres aprender maquillarte pero dispones poco tiempo invitamos nuestro Taller"
773362343011024896,"Descansando casita Joya Esmeralda Sequilla Guayas"
815025223808393217,"Just posted photo Ambato Ecuador"
814833156843012096,"necesita prefectura para reconstruir puentes arrasados por Nambija"
826599657795117057,"you might interested this Industry Trends report"
820301701462822913,"Materiales Construccin IPE Inmobiliaria Construimos sueo IPE Asesora Inmobiliaria"
836794416786518016,"Mis hijos valen mucho mas que precio pueda poner"
766261100828647424,"refugien alcohol las drogas esas vainas tenemos hacinamiento"
847442162903941125,"Hoy invita Espritu Santo vida escucha voz"
825336179155468288,"Rafael Correa viaja los pases con votantes"
769387247514816512,"DIOS AYUDAME SER FUERTE ESTOY SIENTIENDO NADA BIEN"
815651707275382790,"Como sigues primero enero las Via Samborondon"
843942869517783040,"Medicina por todos lados Cuenca Ecuador"
843302003786833922,"Junto nuestro director provincial recorrimos invitando ciudadana votar por LEE"
761667937178488833,"solo dejate llevar por musica"
883047788896034821,"EnjoyGO Maneste ombligo del mundo Conexin"
818134589285826562,"Colimes Balzar"
775063112911351808,"juega Serie Fecha"
842368108727816193,"informa realizar conteo rpido prximos comicios del abril"
842356920153436160,"ANLISIS ELECTORAL pide refuerzo extranjero"
815758712077975552,"caso empate Quien queda con campeonato NFC Norte los los por que Saludos"
838441938370117632,"gente estupida"
832717606675214336,"Unidad para las Vctimas financiar proyectos sociales siete municipios Nario"
841132204856094720,"Hola Voy seguir TODOS que siguen Cumplo Seguidor Seguro"
830782140811968513,"Gana una vuelta Mundo gratis con sueldo gracias MolaViajar"
815059825264574468,"Cdla Limonal"
823947453078630401,"Que risa broder"
840709326125821952,"previa los arrancamos Bosques Costa Via Costa"
830220707204308993,"Estudiantes campeon"
829513650931191809,"sern elecciones para Consejo Acadmico Superior docentes estudiantes empleadostrabajadores egresados"
823618167780081664,"Los necesitamos"
882552559596077056,"CNCO Colombia"
763419597655670785,"Tengo locales amplios alquiler Rimac Chorrillos Cel"
884074861940879360,"nueva casa tambin est bamb"
842240587197755392,"Pal feis"
812647506681233408,"Una linda noche junto grandes amigas Jac Caf amp Music"
766437633367105536,"voy por camiseta gcs"
833886236037242880,"tambin conoc una persona pens que llegara ser tan importante"
811995730986627072,"con cuando tocamos Real Felipe por camara apunt otro lado ser"
815984796316946432,"Mantener puede resultar mas doloroso que soltar"
777701672801927168,"Payaso pngase los pantalones sali Cartagena control"
844373029308305408,"Responsables cadena custodia"
836425368370360323,"que supe los salones aprend canciones"
831132792293642240,"crims humwar crims swissperureq contact trump accus uncontact haley accus peru icchelga suarez cla"
838227606810021888,"Quin cmo llama"
825841401799835648,"Hasta prxima Ocean Club Hotel amp Resort"
775742455912300545,"Pasa tiempo sigo queriendo"
812144578551808000,"Encuentra DESEOS ESCORTS AGENCIA ELITE NACIONAL VIP EXCLUSIVAS PARA USTEDES"
845140820613185541,"disparaste primero"
777284958968774656,"foto que subi hoy debi ser primera"
824367225473822720,"Ingresa dale like quieres que pase"
830973981897404416,"resumen que prcticamente todos los equipos del ftbol ecuatoriano han visto manchados por Hasta LDU con los Paz"
766674683492040704,"Estoy crucificado con Cristo vivo pero soy Cristo quien vive Glatas"
827701648692744192,"Helio Carreiro Silva HELINHO mejor arquero extranjero que ataj Barcelona"
826488150704926720,"Fin rotacin Gracias HEG Hospital Enrique Garces"
819224168285736962,"candidatos participan este acto futur"
846883904300748800,"Periodista militanteAquel que interpreta realidad travs una tesis reteniendo los datos que convienen sustento Fountaine"
839465447263244288,"Para ser sublime del universo MUJER feliz que mejor hacerlo con una cancin del Divino Perales"
845167066353057796,"que sirve amar hay gente que vale pena por simple hecho que tienen principios del verdadero"
834799142840963072,"HOY Ven Tema Recurso apelacin Corte Provincial"
822875900450512898,"Juez empieza ser Tendencia con tweets ocupando posicin Ecuador"
811459895274930176,"just finished cycling xdist xtime with"
839594543087513602,"Vamos Bara dificil pero imposible"
762163073557917697,"Pronto"
824288144644251649,"VIDEO Dirincri investiga desaparicin computadoras patrulleros"
834114472889380864,"Que comience carnaval"
841467816519827456,"Quin crees que falt convocatoria TRI para los partidos ante Paraguay Colombia Junior Sornoza Jaime Ayov John Cifuentes"
842866242943930368,"Jefa Poltica del Cantn Tulcn Lupe Caicedo coordinar acciones con Secretara Gestin Riesgos"
765625737072283648,"JAJAJAJAJAJAJAJAJAJAJA VOLVI COMER AGERO"
837108224708886528,"Gabriel Cortez acaba convertirse ocupando posicin Ecuador"
822260538587643904,"Van Basten era crack tremendo goleador hasta"
822631783023910912,"Quin dijo miedo chucha Comienza recoger para comprar esa patucha unaExclam dulce tierna princesa con ganas beber"
811701437780652033,"das follow prometo ver"
842198837217394692,"Que diferentes podremos hacerlo nosotros"
815415589887942656,"Correccion calle marzo record venta monigites"
767523648991264769,"nico bueno maana que tengoo vacaciones"
834566136960212993,"Zuricatas sonren por causa"
841817284393992192,"Soy demasiado celoso"
838874984219041794,"Visitar comunidades cantones escuelas parte nuestra misin Este fin seman estuvimos Carceln presen"
763138848440324097,"Expresidente Chile niega investigacin Argentina por corrupcin"
822528152320622592,"Ene Saludos amistad cumpleaos Cynthia Chiu Ortiz Muchas Felicidades amiga exitos"
765993235449806849,"Queremos"
884845624469880832,"See you dreams Quito Ecuador"
830778193229385729,"kilometros que valen alegra correr Camino Quinta Las Mercedes"
833856703959539712,"Que lindo ver Lucero nacional"
834744354325536770,"Supongamos quedo Gye Supongamos porque voy Manab"
765225716220829697,"Bolsa Valores Lima inicia sesin alza por acciones mineras"
838453963238277120,"Estoy atrasada eso que quede viendo"
831579747675172865,"cual difrencia drogo fuma vende delincuente nada enfermo"
838078314669568000,"FRENTE PROFESIONALES INDEPENDIENTES PRO CANDIDATURA LENN MORENO con ministro Fernando"
815260878492864512,"indestructible los piratas antao los ahora han podido destruirlo"
821406097856757762,"Espaol Guayaquil Guayas"
826411457730473984,"Por importante capacitar personal empresa manejo TIC"
841808615329697794,"Just like moth drawn flameOh you lured couldnt sense the pain Abraham Mateo"
829723515112783873,"Esta foto encontr bandeja salida email antao"
822571949486379012,"Just posted photo Base Aerea Mariscal Sucre"
845047883997032448,"Vamos Per contigo las buenas las malas"
883326185777790976,"Revisa este anuncio desde los gratis OLX"
844992469926326272,"pronto"
825913708572454912,"Retomamos nuestras actividades Empezamos Pronto"
829485484833280000,"Caso Petroecuador instal audiencia por segundo consecutivo"
882960428099407872,"Woke this outside our hotel Banos Ecuador"
845021446825000963,"Aiuda"
770007352581955584,"Amo que hagas feliz"
813595836315828225,"Estamos contigo Emily entendemos"
833782680307302402,"Ante situacin del pas sobre resultados por parte pedimos celeridad entrega resultado"
831134260853620737,"Cuesta trabajo creer que perodos gobierno AGP ejecutivo negociara sus espaldas haber sido que liderazgo ufana"
847221127650979840,"Los mejores beneficios los Farmacias Cruz Azul Recibe productos gratis todo gracias"
765038115526500352,"Dentro del play list para trotar"
842779325502017537,"colorado tambin castillo que jug cuenca"
845166125486751744,"love with your body"
760999199815168000,"Quin dijo que puede volar creativamente con una promo"
817110068453920768,"ONU cesa cuatro observadores Colombia tras baile con las FARC"
773518593174757376,"Ahora solo nos queda Barcelona"
763547437403373568,"voz expande por Sudamrica entera paso espritu rebelde ese infatigable corajeAmo soberano ecuatoriano"
839167587586035712,"Slo estar con Guayaquil Ecuador"
846459227384242176,"Poblacin agradece por los logros alcanzados favor sus derechos tra"
817603342084042754,"entiendo porque Facebook quiere saber Acaso meto vida que fastidio encama"
827013607682621440,"MantaEcuadorParroquia Eloy Alfaro"
832020409130311680,"que vale extraarte puedo tenerte cama"
843936499565547520,"desarrolla Quito Mesa Jvenes Participan organizaciones juveniles del pas que respaldan"
831542219530174464,"Siento que esta corriente poner descubierto los casos corrupcin tiene una finalidad correccin moralizacin social"
838869069969375233,"Nuevo Comandante defraude pueblo ecuatoriano Las acciones nuestras herencia nuestros"
767912780246687744,"First Mashup"
766920023663271936,"Hoy cumple aos esta hermosa talentosa mujer voz tan increble como ella"
825050765987307520,"Jajajaja peor que estoy influye gente"
840195384160980995,"Llego Gran DaHoy debuta Nuestra seleccinApoyaryala con todo"
846591757101993984,"sirvo para turistear nada porque como horas"
819268637395734530,"respuesta trivia diplomtica"
820500539704283138,"Secretario General habla sobre destaca papel"
846780945575432192,"una Muy Buena Idea Cree Buenas Tardesss Saludos Una Machalea que apoya todo"
831833558528450560,"Pero para supe vivir"
835350148611977217,"aprendido que los principios dan miedo que los finales son tristes que importante camino que queda por recorrer"
837104974224048128,"Zuricatas sonren por"
834489966176595968,"Igual pap Quito Ecuador"
883819138711465985,"Graduacin flaca Dra favorita dalitabarros"
775789225392402432,"despus meses atrap otro Pokemon DIgual flojera desinstalar"
824281856321482752,"Nadie cambiar cambias sola"
837784801327398912,"perdi DNI TERCERA VEZ VAN MATAR"
812760273916399616,"Jajajajajajajajaja"
775901430968451072,"with repostappGetting acquainted with the"
847090904171204609,"Prefecta Orellana Orellana inform ciudadana sobre varios temas relevantes para Provincia"
833118436209332225,"gan muchos bloqueos artistas por defender Rous jajajaja"
828068391592288258,"Fin semana Pasaje Oro Ecuador"
814939779527806976,"Sitio Venta Crdito Sector BellavistaTuri CuencaEcuadorPrecio"
812571788660080640,"Esos encuentros ascensor que repitan para toda vida"
842938827031351296,"Buscar otro lugar donde hacer misma payasada"
885168579699757057,"Ustedes suben ego cualquier digna creadora cuentas fake"
827901312767492096,"hoy duermes cama"
846934917430886400,"perfilan las cejas ponen brillo las uas hacen manipedi etc etc"
775477713951940608,"ahora una tendencia Ecuador"
769263724972609536,"las intensas Pancholovers que van evento pidan Busca"
763521923104071680,"los besos quitaran dolor cabeza broder tendra migraa unas personas"
811390810784727040,"was out cycling xdist with"
820750351980699652,"era hora doto"
820350483084746753,"Casi los pasos cebra conductores creen que pueden hacer que les gana pasa nada ACTs una"
776541380697059328,"ATENCIN tema hoy Computo Trminos"
843323212037586944,"Con familia tan querida Cdla Rio Guayas"
814062034048417793,"Oficial Desde HOY Modo INOCENTES"
817596484476506112,"Garzota"
813417723149565952,"abrazara diablo sin dudar por ver cara escucharme hablar"
763484208530616320,"Debemos rechazar los parasos fiscales frmula utilizada para las lites para los ciudadanos"
816484019097501696,"Comenz invierno sabe que nunca"
777226095393435649,"Daddy Yankee Garzota"
817883454373318656,"Angelito Vuelve"
834258623744397314,"mas importante mejor BIGBANG are Kings"
812049556565295104,"Porque les gusta meterse esas polmicas puyosas cada quien nos gusta que nos gusta sea mejor jajaja"
824399466866372610,"Conduzca con precaucin sector Casa Cultura encuentra aglomeracin personas los alrededo"
816359814045413376,"extraaba este calorcito"
828470425147568128,"Diego maana abren seal para guayaquil"
816660153177088004,"Gracias amigos por apoyo"
830640629449424897,"Porque solamente haces volar tocar cielo volver girar Torbellino"
829366317438365697,"promueve artista ecuatoriano con los estudiantes del Colegio aho"
817542285953040386,"Gracias Reyes Magos"
828080294045573120,"Lol"
837143438193790976,"CMDTE todo caro obrad ste GOB ladrnqhastalos nos gusta tomarnosun buen tragono han tenidoacorralados"
882432892969865217,"sabes porque eres que recibe los golpes"
822285176579334146,"Hermanos monos"
834696354249089024,"promedio las Tendencias del mircoles Ecuador tenan caracteres largo"
769568438838763520,"sentimientos indignacin estafa hacen que las protestas continen"
762422149478879232,"Ama con locura despierta con ganas sonre sin motivos abraza con esperanzas vive cada como fuera ltimo vida"
773300971917152257,"PERSONAS DECIDIDAS INDECISAS NECESITA ESTE MUNDO"
768486784619651073,"Just posted photo Portoviejo Manabi"
811681258648571904,"saludos cordiales pana gracias por fimarme mis camiseta GRATITUD SIEMPRE BROTHER"
817240432384049153,"Ive reached twitter peak its time die"
815271092428345344,"Que puede esperar dices noviao beb"
828917947317964800,"Con los terroristaaaass Jajjajajjajajjajja Salinas Beach"
761353517391052800,"respuesta correcta Inversor que pregunta Como utilizaras dinero"
834246996257026052,"Ohhh vino una nostalgia quiero volver"
842030537124528129,"eso smale las tienen hijos para retener marido las tienen hijos para cuiden otro hijo los"
846758256194281472,"Termina intervencin del presidente entrega escuelas Siglo XXI"
817543775492964353,"esta vez"
823095888155381760,"debera estar bailando durmiendo pero uno otro"
825374511344279553,"perdon"
828444608858296320,"Brady back"
766153293328441344,"GRACIAS POR INCLUIRME SKYPE sexoadancoronacorona BBM FCCCA TELFONO"
835706405982199809,"Flash Informativo"
763804719982706688,"extiende uso Moments todos sus usuarios"
832438787586322432,"Cmplices CORRUPTOSbuscn sus beneficios cambios"
821223503798083584,"ECUADOR Unido Por Lenin Portovelo"
844910243163394048,"travs las capacitaciones tiene como objetivo que los estudiantes sepan como deben actuar una emergenc"
840808927088529408,"todo parece menos presidente hermoso pas Correa"
817237747064852481,"LAS QUE HACEMOS ZAPATEAR"
824020576222281728,"sufras amigo sufres por Barcelona fuera otro equipo diras nada"
820693229125468160,"leninmorenog Guayaquil Ecuador"
777297916109156356,"Que buen ftbol con"
828645580658397184,"derrito por calor que por flaco"
838462780604887040,"Hay gente que habla mal juzga sin conocerte pero normal los perros ladran cuando conocen las personas"
763924109713473536,"Cual Jodido Problema con los Gays Ustedes son los idiotas por aceptarlo son personas recapaciten"
821503167246532612,"Ojal hackearan ests perras ganas que traigo"
777969706795958272,"Unos nachos con queso luego ofi par cervezitasPor supuesto Desde las"
775910037181136896,"Juzgar una persona define quien ella eldefine quien eres"
819549526167941120,"Hoyyy dueves disfruta nuestra promo jarrasccteles"
813166628015931392,"Hoy noche paz noche amor hoy noche sexo liberare tus fantasas UPS"
833744451898064896,"Tan considerados ustedes"
822476840380100609,"vacunaron contra influenza bao Tocoquirurgico sirvi nada haberme escondido"
837902240077787136,"porqu pero gusta dedicarle tweets sobre sonrisas que tiene sonrisa"
816789904881487872,"Que guapooo condenado"
826856443253026818,"Where are the old days The gold days"
840919194258546689,"Con este nuevo trapeador tus pisos quedarn CONGELADOS"
816128601825296384,"como Toby fue mejor Spiderman Ledger mejor Joker"
813754993962586112,"Roque como piedra zapato trabajo paciencia"
763132093425651714,"Alguien est perdiendo helado paseo parque Compis Concytec Ceplan siempre unidas"
844517846596177920,"tenso momento que protagoniz Floyd Mayweather junto dos tigres hotel Mosc"
773351262683267072,"Mas perano que nunca Atte Achilier"
829414589213376520,"celebrar"
768185128443056128,"proteges ambiente aseguras futuro tus hijos"
884976684792938496,"MARKNatura Viva Monique Musique Serkal CMYK MusikLatinoamerican Bookings"
843678936269799424,"unico partido casi saca punto visita fue frente Colombia"
813627286536802305,"Mmmmm"
775058110134247424,"tambin presidente"
842757549405429762,"Clarificando dudas sobre pernisos colecciones biologicas"
817893324531109889,"Balaaaaaaaaaa"
842207300291047424,"Programa Menos Pobreza Mas Desarrollo del reducir aos pobreza extrema"
882940308916510721,"Love BRUNATICOS"
778103054860156928,"Crear cuenta bancaria emocional que genera comercio entre los corazones STEPHEN COVEY"
827996783741718528,"Renovando energas San Vicente Manabi Ecuador"
823949555628580864,"Just about All you need this world yourself you"
770242482827296769,"Para esos que dicen que van dejen ser pendejos unos cmplices otros"
839846148949037060,"Todos somos Ella innombrable alguien Lord Voldemort pues"
824444217015603205,"CUANDO PODRAS SUBIR POKEMON"
821118609007124480,"Muri Gene Cernan ltimo hombre que pis Luna"
882744429949464577,"FOTO INDUMENTARIA PARA PARTIDO Con estos uniformes jugar Barcelona ante Palmeiras"
766747405060571137,"Chicos voto por"
883468991574011905,"Salazar sent muy cmodo fue partido exigente estoy sorprendido por todo genera estar grup"
846846359844081668,"Que golazo chile hpta"
817022134388191233,"JAJAJAJAAJA por"
882411417340702720,"Senecyt Quito agilita registro mdicos especialistas estudiaron extranjero"
845087107295121409,"con estos nuevos periodistas familia dejara escucharlos insisten con preguntas altura"
829189008639016960,"que gusta"
770347533386280960,"Los nicos que acepto vida"
884624254205136899,"dame vida tiempo que quiero conocer"
815970806673108992,"Keeping our thumbs busy Mantn nuestros pulgares ocupados"
773913714944716800,"laclavetv disponible Youtube"
845658660995039234,"mejor trabajo Sincero nuestro Ecuador"
825856894447321088,"Who for livestream"
846222666067591168,"soy cobarde pero mejor estaran bien sin"
841146848542900225,"pueblo sus tipas bien grillas"
816346079184699392,"Buscaremos estamos enero cojudo mierda"
827379838545588226,"khe crjos Facebook odia creo"
844792127435390976,"esta hecho por Balsa Surf Camp"
839494245174165504,"ANGELLLLLLLL"
824105190026608640,"que hacer para salir rutina del"
827328688064708608,"Cambio Ingresa Jacson Pita para reemplazar Michael Estrada"
818877254038077441,"Que tome por sorpresa Recuerda que hoy Martes Mucho para todos clsicos momentos para compa"
845063595511578624,"Out Darkness Into LightTRUE STORIES MUSLIMS CONVERTING CHRISTon Amazon Kindle Click HERE"
883695168716546048,"Strawberry beach forever SAN MATEO BEACH"
838459666694828034,"Vamos por sorbetes"
837901867086643200,"Avenida Octubre"
768559432305373186,"impulsa sector productivo lcteos provincia"
828440868654895105,"queda duda eso"
827706395646640128,"Why you will like this perfect"
815289895593869312,"midnight burn viejo The orange idiot going down"
838851222497030144,"Estas valiendo porque voy poner jajajajajaja"
828998694150270976,"estrese MIERDA"
765358698818523136,"muero por Korina Rivadeneira"
826431320117084162,"Los das febrero inician las fiestas del Carnaval Cultura Alegra"
830588792641826816,"mishel nos traen los sanduiches"
830048049288380416,"revolucin ciudadana corazn los santaelenenses"
765272091855683585,"Luce Genial Cabello Lacio Sano Con Brillo Visitanos Nuestros Locales Gran"
822902681610125313,"entonces caminando por donde los amigos tan Parque Julio Andrade"
827005299911512064,"Jaaajajaja"
845022880861585409,"Vicepresidenta acaba convertirse ocupando posicin Ecuador"
842176614578434049,"Mis personas favoritas Gracias por tanto por estar conmigo mis"
768125690868793345,"Buen trabajo directiva actualSe les cae eran chiros tienen vnculos importantes mejor socio estratgico del Ecuador"
843532055501832193,"Comiendo los Agachaditos Guayaquil Alborada"
819983106753052673,"Solo quede con perro que tiene prejuicio"
841840376046579713,"waaooo esta lluvia que esta asustando cada vez mas peor"
765197771016110080,"Dear your smile the most angelic thingIve ever been fortunate enough witnessWould you mind following"
841437953025019904,"Amen"
817447283788812288,"Espectacular noticia algo que tengo mucho tiempo probar subir mis Live Photos"
882613218576871425,"Deejay Vlady Zam Contrataciones Instagram"
843499000993103872,"corazn cree todo casi todo que hace latir pobre inocente"
766287423252946944,"papitox este nuevo todo tiempo pre perfecto jueves"
817385347986452480,"Que mas quiere mijo ella cumple con todo esto Joda"
845379876580343809,"Just posted photo Laguna Quilotoa"
811379292609413126,"Como pudieron Abraham Mateo"
840200534464241664,"Complementa alimentacin con productos alta calidad lograr los resultados que"
834249947746820096,"Nunca somos tan vulnerables sufrimiento como cuando amamos"
819018801903714308,"Hoy cumpleaos olvides pls tampoco pls"
827337159300485125,"Mis teoras son como los chistes SeokJin sea van"
840230596249038848,"ltltno slo que sabe parte grupo corruptos muy cercano Correa Una humillacin para pas tener fiscal inmoral"
837673236569735168,"Primer ejercicios despus operacin hay que motivarse para llegar objetivo"
776078214993211393,"como estas baby"
843948039605829632,"Quiero por fii seria mejor"
883169406645395458,"Con Alfredo Arias mando Emelec para NINGN lado simple"
816019471206940672,"Puyit everywhere Suburbio Guayaquil"
884950856281600001,"sorpresa del"
841893865988714496,"PARA CREERLas viudas del Chapecoense hacen juicio club por este INSLITO motivoDETALLES"
816771657020964868,"gracias los trolls que exclaman"
814813131440418817,"regrannapp from kuacke Excelente fenomenal Sin palabras significado del evento"
846713551314206720,"KHE CALOR"
812025676672933888,"como cada tarde acompaamos programando solo exitos bienvenidos donde ritmo pones"
839496630407741441,"Just posted photo Victor EstradaUrdesa Central"
832731403162750976,"Cuando sentimiento verdad tan fcil slo verdadero perdurar"
883539924376580096,"ganas una cerveza"
884464620420964352,"JAJAJAJAJAJA"
773938622009573377,"Ama quien ama sonre quien odiaDesde hoy procurare hacer esto"
827178433541189632,"Quitando xido vuelta con furia"
777262643593768960,"veces los valores que practicado enseado han separado otras personas pero nunca mismo"
885192490848071688,"travs Direccin Administrativa Financiera realiza asistencia tcnica conta"
841138181055606784,"gusta Justin Bieber"
883658415825924097,"esta casa medida sustitutiva verdad esta asustado por costo poltico del asalto"
846821947254226946,"Quin marcar era Pekerman"
835240310187900930,"sessantadue autografo Abraham"
768141180542550016,"ochenta cinco"
768251792824143872,"volemos colibris veras vamoh volar"
818911408448503808,"esto dijo Iglesia sobre imagen que llora"
816365965277536256,"hablamos casualidades eres favorita"
763456750737653761,"perd IPPON Dlt"
836047361264742400,"Una nueva meta vida comenzado hacer deporte con mucha conviccin"
815459391612649472,"Recibiendo con mejor compania"
811796693683314689,"Vista nocturna desde Club Nautico Club Nautico del Salado"
816286694051868672,"Constructora rea Sociedad Annima pertenece Gonzalo Monteverde Bussalleu Mara Isabel Carmona Bernasconi"
835504512139988997,"cierta edad que interesa experimentar vida con paz Cualquier cosa que quita paz debes quitarla vida RGere"
811608842488389634,"just began running workout using Peptalk now"
811392028718338049,"completed his food and exercise diary for"
830191259553845252,"red vigas reforzar control barrios dotados tecnologa aplicaciones mviles"
833390778256875521,"nico consejo vlido sera darle absoluta libertad cada persona meditar voto vaya quien vaya Eso democracia nada mas"
833020259296800768,"pls"
841509757001297921,"Buenas noches buen inicio semana Amor Paz Igualdad Felicidad para todos bendiciones"
845790439202545664,"siempre pensado mismo cuando dan largas las cosas porque son"
840590949529071617,"Caminando"
820107530831597568,"como siempre dndole clavo"
846550913221308416,"quiero fumar mismo que estos Borregos para hablar tanta huevada"
845270913700544512,"Excelente Jueves todos"
825919814539415554,"Aniversario Vicsanvany"
764645323079843840,"ahora sali casa queria jugar quedaba parte donde sale cargando quedaba alli cargaba eso"
822955055330430977,"Bizcochita Chicho Guayaquil Ecuador"
846777301593395201,"Just posted photo Naranjito Guayas Ecuador"
761660361179295744,"voto"
765623242719723520,"Dear your smile the most angelic thingIve ever been fortunate enough witnessWould you mind following"
775869123024789504,"hoy acabando etapa universitaria Hechando vistazo hacia pasado doy cuenta que hay nada mas lindo que COLEGIO"
764563336264556545,"pusieron los cachos jajajajaj pobresito"
836399308689694720,"Cole Santo Domingo Los Colorados"
