"id","text_only"
818558942947090432,"Mientras demoran DIEZ das resolver problema demoraron"
818575939613376512,"Hola Diego ayudas con mail para enviarte una propuesta que puede interesarte agregarme para mandarte Saludos"
818665707785388032,"Estas personitas"
818647359831867396,"Votar por pupilos Correa votar por continuismo dcada perdida saqueada"
818825357604298754,"Jun defiende espaol hasta muerte jaja"
818251225368068096,"Dialogando con alcalde Gualaceo una nueva moderna Ley Turismo para fortalecer economa"
818930324755333121,"Que terror perder tarjeta dbito del son das desde que ped una nueva hasta ahora nada peor servicio"
818961124259483648,"Gobierno emiti hoy xdistllones bonos soberanos aos plazo inters Dice que destinar recursos inversin pblica"
819024421981667330,"que drama ver que triste life"
818979097510641666,"Veamos mueve este ejercicio electoral por quien votar para Presidente Ecuador las prximas elecciones"
819027814624149504,"JJAJAJAJAJAJ"
819060215698128896,"encanta buscar bibliografa para mis clases encontrar que cada libro cuesta como cocos encanta hecho salto alegra"
819009102110134272,"CONOCEN ALGUNA FUNCIN DEMANDA TRABAJO QUE PENDIENTE SEA POSITIVA SEA QUE SUBIR LOS SALARIOS SUBE NIVEL EMPLEO"
818986202024071168,"Candidatos Asamblea dialogan con vecinos"
818917898446114826,"Concejales gobierno estn sorprendidos por las actividades que Rodas encarg Mauro"
819257735342686209,"Pepa invoco"
819277332296900608,"Promet dejar decirle puta alguna mujer pero pasas puta Chao"
819213685247852545,"Desigualdad"
819293984052965379,"cul problema que padres protesten por derecho criar sus hijos con valores"
819317416014573568,"conozco pero defiendo Jajajaja encima nos maldice Que horror"
819338002359058432,"ENCUESTA CHINO ADOLFOLas mujeres saben diferenciar seal"
819351625068376065,"tienes que morirte hambre quieres tener buen cuerpo solamente alimntate bien has ejercicio"
819368732585840642,"Acabo terminar grabar vdeo esta semana"
781693340429332480,"Depiladito por hoy tengo ganitas que dejen toda"
819539107491811328,"Congreso pide Luis Castaeda anular peaje Puente Piedra"
819597283633336320,"Nos podra atender por favor Doctora hemos tenido una respuesta"
819517210339278848,"Hoy estuve con una chica dijo que tena temor que mientras chatee con ella tenga otros chats abiertos con otras chicas"
819582000260583424,"candidato dice que han sido aos econmicamente difciles pero gastaba xdistllones sus"
819635104888721408,"Con lograremos tener pas fortalecido servicios salud vienen nuevos hospitales mayor cobertur"
819767695721791488,"Cuando alguien habla fraude porque siente perdedor"
819768454823583748,"reino por una fundita estas"
819893729465139201,"Hice test Alignment Chart para saber como seria personaje Dungeons and Dragons sali Chaotic Neutr"
819665345032187905,"Lenin Moreno dice que nombrar una comisin tcnica para revisar los impuestos conoce otra forma generar ingresos"
819936758309720064,"why thought doing this movie would nice idea the real question here"
819928962184921088,"cifras Esperamos que repunte donde hay que repuntar"
820074106993319936,"Bast salga luz nombre del Alan por recibir coimas Odebrecht para pida nombres aho"
820319435487674369,"Cul para mejor serie todos los tiempos"
820327965389160448,"muchos exitos"
820383310388072452,"MEN TIENES TODA EXALTADA MEN SIQUIERA ESTOY VIENDO MEN"
820446581107335168,"Fundamedios rechaza acusacin del presidente Correa dice que combate corrupcin venga donde venga"
820616678589558788,"Vea resumen del Enlace Ciudadano gtgt"
820687317610414081,"Guardiola siempre tiene que ganar Evidente sensacin alegra aquellos resultadistas que festejan derrotas ajenas valoran legados"
820722522714947587,"tambin travs nuestras lneas correo electrnico"
820766240117559298,"Saben jugador regresa Liga saben Con este jugador Liga tiene casi lista plantilla"
820854124556255232,"Sabia que deba ignorar epidemio estudiar semio"
821084655814381568,"Esperemos que dirigencia esta vez INVIERTA verdadero forneo que sin Mena Emelec perdi gran peso ofensivo"
821158162959101952,"Buenas noches Responde nuestra pregunta con esperamos tus opiniones"
821174366595645440,"Necesito puta seguridad vida necesito estar bien"
821470535796277249,"Eureka encontr"
821499923942277120,"tena ninguna cita para baile graduacin que llev bisabuela"
821515683167092740,"amo"
821551173618561025,"duermo por Estudiar hacer tarea para que revisen"
821546410185199616,"Cuando caiga noche voy por solo esperay djate llevar"
821392310168592384,"grandes empresas apoyan nueva economa del Buscan reusarreciclar del que utiliza paquetes"
821568017146454016,"primera fecha del campeonato Barcelona Cuenca"
821716447189561346,"Parece que accidente sido mismo bypass policia bloqueado carril sentido hacia miraflores"
816836423227686912,"mientras tanto Multitrabajos"
821800686010716160,"Mejor con las ideas Van Basten"
821871366794334208,"Cmo creen que llegar las ultimas consecuencias este cretino fiscal sabe nada del acuerdo los"
821888712011382785,"Julian Assange vuelve condicionar salida hacia Estados Unidos"
821914453168029696,"GORRA MAM GORRA"
821890679399915521,"ahre dejare esto por aqu har mas tarde cjau"
821950569405353986,"Uhmm vyanse con comenta responder estupidos"
821937667273355264,"desgracia Dios como burlan todo pueblo peruano justicia Per hace nada TAL"
821945552610979840,"puedes reparar esto cunto cuesta"
821944773510623232,"pasado"
822118116138352641,"acting"
822029848596062208,"est permitido sbado hacer bueno maloMarcos"
822218121008312323,"Vaya regalazo bandeja administracin Trump Esa cancillera aprende curso diplomacia express"
822486345650085888,"supo Carolina Cruz que iba ser mam detalles inditos embarazo"
822491717769236480,"amo ahora hice"
818208198154928128,"Disfrutando del Ven familia con amigos observar este atractivo natural"
822479409416376321,"operador Odebrecht gir jefe inteligencia argentino"
822494870912831490,"Este clima est loco que por"
822128215821086720,"Hace diez aos ramos puado soadores hoy somos millones pueblo entero que tomado control"
822612689780359168,"mascota del antes presentacin plantilla del"
822621623161339909,"Violencia emitida los medios comunicacin reproduce Aqu una muestra ello nios juegan ser Dragon"
822658882057150467,"Fragmento del baile inaugural del presidente Trump primera dama Video completo aqu"
822632094564315136,"Estos comen delante los pobres"
822622294698840064,"Walter Lung equipo Cristal grande que todos los problemas"
822667126431485957,"drogas dile"
822811111384813568,"prometo nada slo cobrar sueldo vaca"
822572836166438913,"Cuando olvidas las llaves tocas todos los timbres esperas que algn vecino abra desde interphone"
820353093032230912,"Ser bacn ver recordar poca que gente saba lugar los galanes eran blancos los cholos choferes empleadas"
757267171550584833,"contesta tambin una respuesta"
822863481141653504,"Lista Invitados UHC Epic Peru"
823244674886410240,"Una joya Guayaquil pequeo totalmente remodelado Capwell Casa Linda foto"
822848455391543297,"Voy mandar una delegacin del gobierno Brasil para que traiga informacin anunci Correa"
823328863417761792,"ver una cosa dar servicio profesional otra estar involucrados actos corrupcin Ojo"
823378084623745024,"Los que maana entran estudiar vez lamentarse deben sentir que son bendecidos por tener tan linda oportunidad Desagradecidos"
823614065494855680,"Voy volada ese tema interesa muchsimo Mis canas aumentan"
823630853234368513,"sentido psame esposa acaba fallecer luch por varios aos contra cancer hoy"
823638359465672706,"pica piel por volverme tatuar"
823355753453015041,"Todos recordamos historia nuestro Ecuador"
823599670379343873,"Excesos velocidad via YaguachiMilagro ahi murieron heridos piden fotoradares cmaras"
823935296026853376,"Gracias Damin Daz ecuatoriano muy importante para equipo"
823958431061147648,"hay medida nuestra forma querer"
823966861544943616,"Para las que pidieron que les traiga argentino Info aqu"
823938666414440448,"Barcelona logra nacionalizar Daz tambin levanta sancin sobre estadio todo esto solo"
824005870547857413,"Estoy sola casa esta lloviendo cort luz que hago yahoo respuestas"
824074425284853761,"Buenas noches Dios"
818547466198982656,"que espero con muchas ansias Nueva camiseta Sorteo Copa Sudamericana Noche Blanquiazul"
824091350006165504,"entiendo directiva del hizo tooda gestion posible para que estadio llene Que pena"
824094835367964672,"Para refrescar memoria con estas afirmaciones sin sustento respecto estudiante gradu"
824105235266277378,"hare esto por aburrimiento"
824258697190932480,"primo que fan Alycia por fear intento ver porque insistia que conociera Lexa aclare verla partir"
824287605898428418,"Emocin total Estaremos con todas ustedes prximo Abril"
823892087632498689,"Tengo cifras gastado RefEsmeraldas llegara mayor atraco historia"
823940042502631425,"Recuerda puede ser tuya Para participar solo sguenos envanos mensaje con hashtag"
824321883185250304,"cara cuando avin aterriza Guayaquil Barcelona como prometieron"
824327450440200192,"rehuso darte ltimo beso que gurdalo"
824344446837919744,"cada vez que cambias user"
824453705617539074,"Que alguien diga Cinthya que reduccin empleos culpa del empresario sino coyuntura econmica causada por Estado"
824466082899628032,"Adivinen quin tendr los millones trabajos que ofrece Lasso Exacto sonidista"
824467065436274689,"espinel Correa par periodos guarden este tuit proftico apocalptico"
824500179780775936,"guess they have not too happy about"
824244335407415296,"estuvo buenoA buscar Norte sin antes recibir los besos hija que curan todo"
821711336413560832,"Algunos disfrutan sus vacaciones del trabajo universidad lugares recomiendas visitarcerca"
824699955633852416,"Quin guerrera mbar Montenegro Angie Jibaja"
824805016963801088,"Las series que actualizan Netflix ganas buscarlas Google pero tengo miedo que salten algn virus troyano"
824636546162700291,"Huawei Mate creado sentimientos encontrados Excelente rendimiento autonoma pantalla comn una cmara que brilla"
824853006097141762,"PERO que esto"
824600759723577344,"gust video Ricardo Perotti Aunque donde ests"
824457040970088448,"Toditos hacen uno incluso con ahuevo"
825069910267138049,"Ayer pude observar Carrillo cantando una barra Muerte mientras filmaban presentacin Crack hincha Liga"
825173842322681856,"ami ami"
824985592807247872,"Solo cuando ltimo rbol sea cortado nos daremos cuenta que dinero respira"
825321827706732544,"Buenos dias putos"
825531135056699392,"Always"
825576801879650304,"Alguna vez han visto algn ente oscuro han sentido presencia ser inspirado maldad profunda noche habitacin"
825585855477735424,"Hinchas diciendo que lnea era cagn que por eso les anul los goles Graciosos ejemplares"
825778584346300417,"peor puede haber servicios una consulta IESS ese psimo servicio"
825816855310790656,"Ando polanqueando Gdl"
825828380473843717,"Totems del periodismo expuestos usaban escudo moralidad pero pedestal puro estircol maloliente"
825869256067792897,"Estamos Angustia respuesta Colombia traduccin este tipo quin falta"
825917847280943105,"Que lindo verte asi caray estoy echndote menos como siempre"
825941561166929921,"dale fav este tweet digo piropo ahr sacado san gugel"
826091839493173249,"Par locos"
820647337899032577,"Muy mal partido Argentina"
825963631590391808,"Las mujeres son invisibilizadas sus aportes ciencia"
826158609956495361,"mini Tri est fase final Mira Ecuador Brasil por los canales"
826404431826665472,"mis amigos conocidos vecinos dicen que soy decente Eso MUCHO Per"
826436387461283841,"Temblor Quito sent piso del edificio Argentum"
826463059044626432,"cada vez falta menos das zmhef gracias por hacerme tan feliz"
825709315369664513,"Los abogados hacen balance justicia CorreaJalkh verdadero fiasco"
826489487119224832,"Desde Enero del hasta ahora Marlon Jesus tiene goles partidos todas las competiciones con clubes distintos"
826500352937693185,"esto twitter fiscalia cojudona pica rascate"
826463464457637895,"Cuanto tiempo estima cuanto hay que para tenerrenovar"
826594942239854592,"Reportes indican este trol opogt est clonando las letrinas cada opo Alerta municipio"
826586683785232384,"por favor ayuda sur hay energa elctrica Cdla Valdivia hace aproximadamente horas"
826796337219911685,"MIS RESPETOS EQUIPO INICIO COPA LOS POCOS PERO BUENOS HINCHAS QUE PUDIERON APOYAR FELICITACIONES"
826872783942610944,"comi pastel"
826651939987402752,"usted naci Ecuador Barcelonista usted naci pas equivocado"
826623312700792832,"Peruano peruana sabes aeropuerto Chincheros construir ganador licitacin est"
826971999675219968,"COMO QUE CLUB PENGUIN CERRAR NOOOOOOOOoOoOoOOO"
826683457212383232,"pobreza acorta vida que obesidad alcohol hipertensin"
826982385531109381,"Dios que creo hizo esto hoy"
827012153374711808,"Gobierno solo confundido debate"
827220791850835969,"olviden que estos son misma banda"
827432105290379264,"lindo verte hermano quiera para una charla rpida"
827499489711812608,"Putos curuchupas mierda"
827381143074807808,"Malo malo malo Malo"
827588532617232386,"usted podemos acusar porque nos consta nada Carlos Pareja"
827595237384187904,"Cuando bailo ebrio osea siempre que bailo doy vergenza pero importa divierto montn vivo"
827639292155543553,"PPK considera que congresista oficialista Moiss Gua cometi exabrupto pedir vacancia presidencial"
827605439047168000,"Hoy volv cocinar Omelets estoy apriendiendo gente estoy aprendiendo Dganme que debera aprender cocinar"
827694963244859392,"Lindo negro csm gente como necesito vida motivadora"
827709975459930112,"Harrison Mojica pequeo que Medelln"
827730114901209088,"Listen not advocating provo but there bench outside this show and one told suck dick the bathroom stall"
827734497680564224,"seorita cajas hace tiempo que llamaban asi"
827759453508284416,"you know how excited love with someone its very but also must maintain purity for now"
827860502235774976,"mejor formato mensajes que envi Capaya mis respuestasInsisto necesita polgrafo sino psiquiatra"
827875437342756865,"Kia est jugando club penguin tambin quiero chau"
827505373443719169,"historia Alejandro Toledo las empresas Interocenica Por Gabri"
827956292417421314,"febrero votar por CAMBIO Vamos todos juntos por CAMBIO Gracias Esmeraldas"
827952317840359426,"XciertoAnochealguiensubi YouTube entrevistaSin conocimiento autorizacinIncompletaeditada Vanla Ysaquen sus conclusiones"
827954315818106880,"Con este calor mierda mejor pareja que puedo tener que vende marcianos esquina"
828269688962560001,"Feliz Cumpleaos Cristiano Ronaldo"
828236687016882178,"Ser que sos ngel pods disimular"
828340972580802560,"thats even worse how can you have waffle without butter and syrup each square"
828382809798635520,"Slayer Chile"
828405000208527392,"Ptmr los Patriots suben xdistermoso"
828447189328343040,"Colombia luchar hasta final tiene ftbol para pelear Piscis Restrepo"
828452534171922433,"Correa dice que Dalo debata con Segismundo deber debatir con una mula porque padre fue mula del narcotrfico Ubcate msucio"
827944854474878977,"Vamos estar unidos ganaremos rotundamente Construiremos pas responsable que olvide nadie Seguire"
828602750816624641,"Entiendo por temas legales hacer una aclaracin pero esto tirarla TTinoco debajo del bus despus que"
828614477205667840,"Para mejor merece"
828696341656326145,"Con Fernan ganando subs semanas Rubius meses Pos bueno"
828734567045595136,"Esto del Twitter una vaina las noticias los medios hoy son las mismas que comentamos ayer"
625152702209753088,"JAJAJAJAJAJA Que tonta que por dios"
829034861067374592,"Tengo tres viajes pendientes Lima Ica Selva"
829054310919073794,"estaba muerto estaba editando"
829134959067746304,"sabes cul empresa que charte Atltico Tucumn otra vez Lamia Con Uruguay pas algo muy similar"
829147845701705728,"Entregan patrulleros inteligentes para reforzar seguridad ciudadana ncash"
811976465130590208,"Cuando mal ibas enamoraba arrepiento este amor"
829323790094106624,"Buenos das"
829344420193562624,"acord una personita jajajajajaja"
829367587364544513,"Absolutamente inspirador George Capwell"
829386038086946828,"WWW dense una vuelta dejen sus comentarios"
829423876312555521,"Como que hay dispensador agua YML"
829463065313812480,"Sera buen versus"
829476890905870336,"Presidente Correa como usted muestra mis emails tambin voy empezar mostrar los suyos"
829448346318299138,"Nombren sus Favoritos cualquiera Para Invitarle UHC"
829495823595614208,"Para que vean cmo miente este pobre hombre aqu estn todos los mails del junio"
829638976487116802,"Gobierno prepara salida menores las filas las"
829669965246636032,"DOCUMENTO BSC riesgo perder puntos por Caso"
829693328962756609,"Capaya corrupto que quiere irse solo infiernoY por eso quiere llevarse con con complicidad periodistas"
829705772368007169,"Amor Puedo preguntarte algo sin que enojes claro pregunta nomas Cmo era que llamabas"
829731093238652933,"asevere cosas que puede comprobar promociono defiendo Fiesta Brava hay lucro por medio"
829791527488589826,"Una Leche Tigre Apumada"
829856487736483845,"clase brujera esta"
829872546933768193,"que est pasando con puede pasar con cualquier equipo peruano realid"
829890395471564801,"Alejandro Toledo Poder Judicial dicta prisin preventiva por meses detalles aqu"
829919265687891970,"creo vuelvo creer"
829905433250893824,"Por marido recibi donacin"
829933319169011713,"PINCHO"
830078135517458432,"Que vayan todos"
830122793492762625,"Cuando Andrs Guschmer sube alguna selfie suspirosubi una est con CLuis Morales primer amor Barcelona"
830119257912569857,"breaking news cherik gay"
830448327003164672,"Catlicos del Per dganme dnde marcho dnde firmo dnde protesto para luchar juntos contra impunidad Figari"
830148665222299648,"Maana tod invitad Azuay Cultura Tradicin esperamos para vivir esta fiesta color alegra"
829847077039509505,"Retroceder nunca Estos testimonios refuerzan compromiso seguir construyendo Futuro Gracias por abrirnos"
830808107752251396,"Creo que esa pecera que nos vendieron ayer tena trago full barato porque este chuchaqui est que mata"
830873831803871232,"que faltaba creers nombre que Mara Gabriela Chvez puso perro Fotos"
830894381615943680,"ricos looks algunos jugadores Hay uno dos cada equipo"
828097241449644036,"seora"
831223328497078272,"Una semana despus haber vuelto casa todo pinta mejor que aos Pero alejarse costumbre Todava queda mucho para volver"
831241906386501633,"Que raro que han hecho conocer esta actividad todos los miembros Barra porque"
831271674725163010,"doy cara Esta noche por estar refiriendo los hechos que muestran video entre Jacobo Rivera"
831304304048877568,"VIVO declaracin del Barata sealado que ellos han pagado ninguna coima Gobierno Ollanta"
831496101681328128,"Buenos Das Bellsima amiga"
831632347606941697,"peor que puede pasar gastar plata culear"
831963951307096064,"Falta que existan niveles XXL geometry dash hago referencia Larga Espera por jajajaja salu para ceack"
831985116327051264,"terrorista Abimael Guzmn tenido juicio injusto Debi ser colgado quemado plaza pblica Tiene miles muertos espalda"
831621347096854528,"Ive been searching someone exactly like you"
832010237246849024,"buenas noches mundo feliz noche miercoles"
832075710365888515,"supero buu"
832075454391648256,"tengo sueo cuntenme algn chiste alguna cosa"
832088860221915136,"Que feo que mejor amiga ignore por porque esta chateando con novio"
832070936165810176,"Totalmente acuerdo"
832033825790296067,"VIVO Otra vez present Proyecto Ley matrimonio igualitario Crees que prosperar Opina con"
832351863307640833,"Existe algn lder con calidad moral para encabezar una marcha contra corrupcin"
832378156673859585,"mejor que nadie sabe JAJAJAJA huevo voy asesinar personas"
832187276696420352,"LTIMO Alan Garca lleg Per someter todas las investigaciones"
832426977038573572,"tiempo est contra horas"
832401957545447424,"Inaudito mas embarrada con dinero corrupto Odebrecht Oas Marcha Contra Corrupcion tal marcha jaja"
832640490591752194,"Our Tonight Show turned Prom Parrrrrttty love family"
832714728354877440,"Manden las casaaaaaaaas"
832668867424038912,"Nuevo Rgimen Mype tributarioLa norma tiene como objetivo que las micro pequeas empresas tributen"
833057402060677121,"perdidas aun puedo visitar familiar pregunta del milln cunto tiempo harn perder"
833153097388146691,"vale demasiado bella quiero casar con ellaa"
833203241122983936,"peor del temblor estar sola casa que hermano diga que tome suave"
833391413475807232,"apoya lasso seguimos manos nica forma sacar estos ladrones UNIRNOS"
833446464357597186,"Ese resultado del estado propaganda pas ignorantes"
833464851347423234,"esto"
833502685299097602,"Vamos por Mas MashiRafael JorgeGlas Lenin"
833527620453224448,"Creo"
833517277362475008,"vicepresidenciable CREO Andrs Pez lleg plantn frente CNE que esta hora tom avenida"
833719875067600896,"Algn documental arte msica Netflix"
833786996308996096,"Manera morir Que Harry cante cerca One Direction"
833829997936795649,"Veinteaeros diciendo acaso recuerdas cmo era pas antes Pana hace una dcada tenas mundo era comprar limn con sal"
833861388166656001,"Titular conveniencia puede esperar UdsLes cuesta bastante trabajo cumplir ley comunicaci"
833876965916545027,"Olvidmonos del Carnavales hora patriasigamos vigilia hastaque confirmen vueltaellos esperan que nosdescuidemos"
834073115646889984,"que tal amigos miercoles retiro chequera Que mal que existan servicios por internet que son atendidos"
834107591756242946,"Coder invoco"
834130045883015174,"Hay rumores que los chicos van los brits estafan sabes creer veamos pasa One Direction"
834158117801832449,"Andrs Prez rolo que"
833998113060900864,"Compartimos del"
834164396729462784,"Oye aparecido esta gatita edificio por pedaggico estar perdida ayudas dif"
834189050424737792,"victimizacin como moda poltica Piden investigacin para algunos pero cuando les tocapor tanto odio"
834194539325829121,"sin agua Guayacanes sin programacin como era esperarse pasaron las elecciones volvieron ser los intiles siempre"
834215002043187200,"Literal"
834288824909955072,"Eres Amor Vida destino saba hoy puso ante"
834390094521966592,"Necesitamos acuerdo plural para recuperar democracia votaron por Lasso por Moreno"
834366594243518468,"Gracias"
834490625370292230,"estn viendo los efectos haber trado observadora desde Venezuela Tibisay campeona maosera electoral"
834491556967104512,"las pruebas remito conciencia justicia social Ecuador democracia"
834470583790403584,"ustedes pero gusto sudadera jijiji"
834453084474576897,"Para los coleguitas shock por revelacin las cuentas sachadeidad PPK Toda documentacin obra FBI fiscala"
834744379663405056,"Buenos das Cierto ojal simbolice limpieza para tanta suciedadpolticamente hablando"
834841917213048832,"Como extrao mejor amigolt"
834852020771291136,"que tiene que ver alamo mira poto que fuera piedra para admirar tremendo tubo"
834894395614756864,"Obvio puede ser una falta tica pero pasa delito pero obvio que Odebrecht dio gratis dinero"
834934784782712833,"Aunq sea xdistills"
834981282052517888,"les dijeron que Mundial Clubes este Japn"
834951655858782208,"viene"
835317896549117953,"Per estn retazeando los pases vecinos Isaac Humala"
835355638930751488,"debi ganar competencia folclrica"
835659987116511232,"Lasso Lenn segn CEDATOS Repblica"
835588849480921088,"Bella bikini Cartagena Pueblo Libre"
835845572636598272,"cielo cay Portoviejo estos momentos diluvio"
835985705448923136,"Este presidente que tenemos Dividir los ecuatorianos principal arma Que verguenza"
836052059124346880,"Ayer Jaen Per bonito"
836035278729064448,"chusma"
834557924773076992,"Tengo compaero que usa misma camisa blanca veces semana"
560096732949020672,"Erase una vez"
836433765614370817,"janzo janzo jamonada"
836047616244854787,"repudio social revista jamas volver leerla"
836560691389685760,"Por defensa Nadine pide tambin nulidad muerte Fasabi falta vergenza"
836712526234673152,"zyuoh bird mario discovers their identity mmkayOh and still dont know when zyuoh ninnin takes place"
836745604562841601,"Baila bien sabe cocinar"
836761403272884224,"pregunto donde esta gente que tenia bbmsn que alegran Whatsapp"
836776126341087233,"Cuando babosa manda ver Manchester the sea"
836828589890879489,"Euge dale quers ver ella"
836970064410775552,"buen nuevamente los vehculos hacen uso indebido pblica calles Roma tiempo"
837037539714338817,"Que pregunte Vidriovp alguna vez escuch nombre CAMINOSCA seguro dir que sabe nada honra dice vidrio"
837043869808197632,"Daisy taught some Spanish Pene Penepenepene"
836991356912484357,"meet amp greet con ser maana ests listo Twittea con gana"
837103399959150592,"den fav"
837122743812386820,"sabes amor love you"
837307981196820484,"Cuando pose esta por encima"
837328054259179521,"LOGAN CANCELLED AINT GOIN WATCH"
837183461630832640,"Uno estos das voy lesionar otra rodilla voy mierda silla ruedas porque podra caminar"
836833478176014340,"Building app prototype Heres the complete howto guide you can launch days"
837367653266251777,"alguien quiere tomarse caf conmigo"
837461894122332161,"Por martirizan con poltica quin ser prximoEs como sufrieran por pareja con quin pasaron tarde"
837477807957622784,"tuviera que elegir algo que haga feliz despus Dios familia vienen los libros simplemente los libro"
837524895676313604,"Ambar salvada por publico arrastra cuarteto cuarteto Fran Seba eliminan cuarteto Leo"
837678300101246976,"Eso para las calzn flojoNO GENERALICE"
837727708603957248,"Estn saliendo las convocatorias las selecciones sale dos semanas calmaos eros huele elimi"
837742822212141056,"vocero Con mis hijos metas dice que Minedu puede decirle los nios creer pues saquen curso religin rai nau"
837767063645081600,"Maana nuestro Presidente develar todas las mentiras campaa sucia por"
837771847638855683,"pensar hay ilusos que les creen todava"
837832208085823488,"RIVE UCA Hernn Galndez jugando partido con los ltimos forma consecutiva falta desde Ago"
837460744761409536,"Venta paca ENCANTO JESUS"
