"id","text_only"
761586760925216768,"Tecnologa para produccin reconocimiento voz herramientas traduccin"
763824170664943616,"Dear your smile the most angelic thingIve ever been fortunate enough witnessWould you mind following"
777680187362275328,"IPAC"
821157429597663234,"viene una semana super intensa"
828168536950448128,"hay amor mas lindo sincero como este"
825165007247831045,"Pobre Altagracia"
828371026966880256,"estos inutiles dejan entrar carevergas los xdistn custodiados por son una verguenza"
817955130213597184,"Quiero decirte que esty esperando Farruko Con Mirada Ozuna Video Oficial"
774098533993414657,"septiembre salio aire Conde"
776879446494027776,"PALO MURIEL IBA SER GOLAZO VIDA JIJUEPUERCA"
764967382322442246,"Guayaquil Ecuador"
767583599314997248,"Mujeres con labios payasa"
826638178991951876,"ternura mucha gente inspira ternura todos pueden romperte corazn Mucha gente llega Otras Otras matan"
882948109810249730,"VIVO Ministra Martens Tenemos que mejorar condiciones maestros tambin sus competencias"
833621580223766530,"Semana exmenes finales llueve torrencial slo espero hora deban venir los expresos sector sea Venecia Guayaca por"
836657738524446720,"Quieres ser libre deudas lnea crditos Cafam trae para compra cartera Para informacin aqu"
834029016571052032,"versi pierden ruta directo crcel sin pasar por cobrar claro que quieren hacer cne"
767142035275014144,"Hay veces que sentimiento perdura por mucho tiempo sabes luego que fue hermoso slo que deba tomar con calma despacio"
817467858708037635,"ERICK"
882819689616990208,"pacto con Bucaram impresentable intolerable"
776144126194647040,"Just posted video Urb Lugano"
834897149552963585,"arcoris eso amo Calderon Quito Norte"
838396546957856768,"Que sea una cosita segura"
882271822808526848,"VIVO Presidente firma libro Sociedad Geogrfica del Per"
840748892245381121,"SILVANAA"
761417659871293440,"Todo tiene final nada dura para siempre"
764288754056134656,"hay haley que mandado"
835030683760398336,"veces Juanpa hizo sonrer"
840358489243414529,"negra sus dibujos"
767555790685237248,"primer latinoamericano que aparece medallero anfritin puesto"
828748692194746374,"Estoy Mixlr DIGITAL RADIO ElEspecial"
769622343647920128,"Ahora les voy ensear PODER"
811358368749277184,"just finished cycling xdist xtime with"
831309783877689344,"Imposible estar nostlgico con este par delincuentes"
834131358112944128,"Vuelva presii cante fuerza los pobres ayude parar corrupcin Ecuador extraa abrazo"
825414069993795584,"Une aporte suerte"
824849446424809472,"Debera ser ilegal"
830041130255470592,"tengo envida esa esa tarjeta"
840002774863601664,"DULCE MARIA ITUNES"
768113185496772609,"Respeto consumidor importante que entiendan diferencia entre Publicidad Contexto ante Comportamiento"
767851456758243328,"ESTN AQU"
819888169013415937,"Hoy siempre juntas negrita"
835182210869301248,"Compartimos encuesta Cree usted quedevolver atn que don pueblo"
775753354936979456,"Pueden que tus besos hagan delirar suele ser tus labios mejor lugar"
811586603063726080,"CONFIRMADO retorna pas Febrero Banda chilena realizar concierto Parque Exposicin"
840887778472685568,"sunrisesunset will"
811637840291495936,"dices que sientes nada muy bien que gusto nota por encima ropa"
768573130499563520,"Tengo las piernas mas cortas que pollo fdj jajajajaja"
847088675385229317,"cmo piensas enamorarla"
829539178471886849,"nieto Daniel cuando tenia aos"
826118653338873856,"Ven con familia Exhibicin Los esperamos"
830266646673629184,"Ministra Justicis supervisa proceso cedulacin cerca internos del CONOCE"
766023372778172416,"JULIO LLEVE VEHICULO REVISION CORRESPONDIEN"
825728587315740672,"con CSC instalaron Sistema Monitoreo Estadio Alejandro Serrano Aguilar para Campeonato"
812863190358982656,"Feliz Navidad"
811976674577358848,"Usa este cdigo recibe Crdito Cabify"
838911751265599490,"Tabacundo Hacienda Fantasa listos pues para grabacin"
763785303861714944,"Pero que son muyyyy malos que los cazquen pero que les den chuzo"
846060969738539010,"que tengo cara chibola para comprar cigarros pero son para"
776544963718967296,"Sonando only have tonight radio tropicana"
761607060605722625,"cerveza mejor maldita bebida del mundo"
834150690717126657,"Celebramos noble profesin brindando atencin calidad llegando ltimo rincn patria"
835230928406528005,"veces Juanpa hizo sonrer"
761233475290660864,"pierdas comida quema grasa por contacto tendremos historia sobre cuanto afecta sobre peso cama"
815421110711971840,"Shhhhh Facciamo piano che sta arrivando Feliz Nuevo tod Gracias todo"
827661456082599936,"puedo quedarme sexto"
761605448126595072,"DESTAPZrate dio cara respondi sobre millonaria demanda Barcelona VIDEO"
766470843710992384,"Dime que paso con aquella promesa por favor regresa"
883129546911993856,"Atencin ChicasTaller extensiones pestaas pelo pelo diseo cejasDictado por"
843704854468067329,"Por Tumbaco llueve terriblemente"
824040934761496576,"desea conocer sobre poesa msica sintonice"
838482600796819456,"NOVIO HUEON MASTER vvv"
767005865299685376,"Disfruta nuestros paisajes djate enamorar del pas acogedor"
883141566147080192,"Viva ROCK AmericaGuayaquil"
821140325196529668,"asustaron porque entro team Colombia"
817127052860014592,"una las series que nunca subistes naaa"
767403904413929476,"siguelo sigue"
825908687550160896,"FOTO Los detalles que sabas coronacin Iris Mittenaere como nueva"
819529397145403393,"Sueooooooo"
839541799853178883,"Vamos ganar"
884820567244910592,"Cuando estamos juntos nos falta nada"
813844094199930886,"Hasta siempre Leia Carrie puede decansar paz"
767731567338946560,"Buenos das excelente inicio semana Podran poner adelante Gracias"
774954183086731268,"LTIMOConvocatoria del dolo Delfn SIN UNA SUS ESTRELLAS Entrate"
766821516608544768,"Los sentimientos delicados que nos dan vida yacen entumecidos mundanal confusin"
825012474202226690,"Amor platnico"
838874397595340800,"thx for the retweet ill follow you foreverrrrrrrrr"
884378285416882176,"justo por esta razn por Correa debe irse debe quedarse ser juzgado condenado ciuda"
776990712705540096,"Pngale nombre foto Guayaquil Ecuador"
834905728460685312,"Repita conmigoLa corrupcin elimina votando por LASSO por LENNNo mienta"
882348702211375104,"MALA EDUCACIN decirle flaco estas flaco gordo estas gordo cada persona sabe perfectamente como esta"
769462252655276032,"cuenta arreglas conmigo sino con que tiene control del cielo infierno"
835106142057529345,"Cmo sobrevivir despus esto"
812938751005560833,"Just posted photo Parque Samanes"
833907874409619456,"Cudate cllate llenan los bancos atn por culpa tus panas miserables"
819884411273486336,"RECUPERARSE Reinaldo Rueda operado con xito Cali"
767755955786412033,"Solo Emelec quema jugadores jvenes con gran futuro como Portocarrero Angulo por darle chance tipos como Guanca"
833460069203312642,"Este twitter explota jaja"
764134844343455744,"como est"
764286840023187456,"agustin"
814845834844106752,"soy diablo pero doy calor"
844670549007716357,"Todas las enfermeras cuando entran cuarto dicen congelador supieran que amo dormir todos los das como oso"
767871079012528128,"with repostappCuando vas con otra pelada topas mejor amiga"
883528875845799936,"Este tour Francia est como medio aburridon"
817824066581184513,"LOCO ANUNCIOS toque DISTRAER atencion ODEBRECHT"
835329106682200064,"and sunny today and snowy tomorrow thanks ohio Bipolar"
834386830845997057,"congestionamiento vehculos puente unidad impidi Nebot llegar Ecuavisa Ser ser"
824801357609713664,"Toda buena historia empez con una copa vino"
773373347442876416,"SALVA OTRA VEZ ESTUPIDEZ"
824485103720079360,"Por favor dejen pelear informen sus respuestasEl garrasposo DalitoBien beb bieeen"
830081408135786496,"nego esquece cara isso que conhece desde anos"
823952942306889729,"Existe una poltica igualdad gnero PerMara Gabriela Villalobos conversa con"
762521073615249408,"Happy birthday God bless you"
819965125599907840,"MrJames usted pendejo"
827317560693706752,"Hoy fui Gigi ped corte pesar insistir varias veces exactamente como querael cort tom iniciativa decidi corte"
763402013975646208,"Challe Puma son todo menos tcnicos Per eso poco importa como profesionalidad todos los sectores del ftbol peruano"
777348942438817792,"Eres sers que siempre quise ped"
762078257328054272,"encontrar bandida corazn tienen algo pendiente los dos"
884028989039423488,"Consejo para hoy Buenos das"
842448126933925888,"gente por general dice verdad"
838931193143955456,"Actas como nada"
824987350027665408,"conmemora Que comida sea alimento alimento sea medicina"
839604604472033287,"regalo perfecto para toda mujer flores plantas precios desde"
768468829722841088,"bien comenzando"
815649820702633984,"get follow you you follow please"
842065467665723394,"hoy Peru GBC est aniversario Muchas gracias todos nuestros miembros todas las personas confa"
825471855976910848,"Ciudad Mitad del Mundo"
776532292554596352,"Vida trata ser"
823622240545685504,"las sea Cdla Patria Nueva"
774023370325188608,"Just posted photo Cdla Los Esteros"
845657799539470336,"milln besos tengo para darte"
817071041788936192,"little girl months Duran Primavera"
775778659500224512,"Secretaria General visit Videna habl reunin"
815223811347886080,"tenemos instaladas sirenas colocadas Esmeraldas Manab las poblaciones cercanas"
839188921619734528,"dictatorial ahora una tendencia"
883881670927142913,"glad have nez life can tell her love eijun times day and she wont get annoyed"
883663143347511296,"Aunque pueda entrenar accidente bici justamente una semana atrs bla bla bla los"
844741278218694656,"Out Darkness Into LightTRUE STORIES MUSLIMS CONVERTING CHRISTon Amazon Kindle Click HERE"
824715898741202944,"RECUERDE una mesa informacin del Padrn Electoral funciona consulte junta recinto donde suf"
812503654389448706,"habra sido"
828786247841767425,"encanta"
774393551828451328,"gusta oro encanta platino"
882696532117651457,"puede liderar pas sin prepotencia respeto hacia presidente"
824347293549809667,"Csar Navas ahora una tendencia Ecuador"
772877270633578497,"Existen tres cosas hacer con una mujer puede amarla sufrir por ella convertirla literatura"
814265584737075200,"Fiscales panameos renen con Galo Chiriboga para intercambiar elementos caso Petroecuador"
840972173070200832,"Ley vida Estar uno para otro cuando los necesitas"
814110879411212289,"Bicicleta"
846383970409373698,"Sentirse libre Sentirse nica Luis Obando"
814534704921739264,"Creo que nunca voy entender cuando mismo los inocentes"
884220382785540096,"shell what she does best shell pray for his soul JOYA"
845076747137814529,"GOOOOOOOOOOOOOOOOOOOOOOOLLLLLLLLLLLLLLLLLLLLLLLLLLLLLLL KHE VERGAAA"
823256867229073416,"casual usando twiter"
830991941944868865,"BRONCA CON LAS CELLISTAS VIENE ANTES JODAN"
764901248575340544,"Una linda noche"
842751038352474113,"Cota MAR"
826559577701416961,"suena"
838953158139334656,"Ill appreciate kind anonymous visit photog series ignore Ill understand Thks"
843502358311124992,"las opciones actuales necesariamente sern las soluciones corto plazo requiere una mejor candidatura aos"
821364148206452737,"holaaa Saludos desde Ecuador Muffin Tienes alguna mania cuandos estas nervioso ansioso Byeee amo"
761646620605878272,"Lundin Gold concluye acuerdo inversin para extraer oro Ecuador"
829711629843591169,"Rayando Sol"
763170514663866368,"DURSIMO VIDEO Arturo Mina fuerte patada sobre Casquete prctica River"
766070594643324928,"NUEVAS REFORMAS LABORALES"
845454131464732672,"Todo con tal huir Ratas"
817002871032057857,"invitada del por tiempo"
817168298903293952,"Descubri agua tibia puede ser Dios llevamos"
832807378911318017,"TOP"
828439221224501249,"Conclusin Lasso Viteri son all opcin Moreno desesperado promete cosas contrarias que gobierno predica realiza"
818278585953882114,"exes and the ohs they haunt"
821140517807341570,"cuando provoca algo quieren quitar"
762116916668428288,"Larrisa"
830655735898001408,"Little Alex was born Hotel Campo"
821942181388808192,"ven con"
812715351557410816,"President announces cross country tour for next three months"
829673866976956417,"Boletn condiciones ocanoatmosfricas para Regin Insular vlido hasta las horas del"
823712218231558145,"ofrec que vendr aqu Castigo poner ejectese derogar Ley Comunicacin"
769413587613937664,"Cena con mis compadres familia Ron ahijado hermosa hija Keyra friends"
834002187982344193,"velo por democracia"
845726216116191234,"para los extraamos ftbol aqu poco nimo"
846195490383388672,"Guayaquil extraa Emelequi"
839509763893383169,"Todas las anteriores jajajajaja posi posi"
823911661513883650,"solo xitos"
835348215180447746,"rompio cadenita esta matando"
835463517956411392,"PLATA PLOMO Colombia Medellin"
841452311763382274,"LEVANTEN MANO LOS QUE NUNCA LES QUITA HAMBRE"
882800137449476097,"Brasil hay que recuperar Pineida estando bien mal Velasco debe jugar porque defiende que Tito"
830247252673384450,"cerca Puyango Tumbes"
764183061428928512,"Pero que ricas estan las jugadoras Alemanas"
844227601564663808,"siempre"
825126016045694976,"bestia voy comprar una GoPro solo para grabar eso"
832977877704470528,"Tres grupos mineros Zaruma firmaron contratos operacin"
825142951114321923,"yin yang Equilibrio perfeccin"
818261041931059201,"Slo nuestro pas Esperemos haya salido nadie herido"
818126336929779712,"ahora una tendencia"
834073745018994688,"Ecuatorianos podrn consumir estupefacientes lugares pblicos"
833583968511463424,"Una Sola Vuelta Carajo Viva Revolucin Viva Lenin"
775145024057122816,"Las Torres Gemelas fueron los destinos tursticos fotografiados por los turistas argentinos hasta cada"
846497593681235968,"busca mejor imagen del este bello atardecer"
813403102132965376,"Hoy una fecha muy triste fuiste Carlitos Frenton Muoz hincha siempre recordaremos"
761767724884328448,"empezamos"
832431082825973760,"Hermoso junto uno mis mejores amigos pasamos"
763558305994342400,"Sospechaba Melanie Sorprende"
884226978055942150,"Cerro San Cristbal Nio entre aos herido permanece hospital Almenara"
824142277694124033,"stoi loco por bolverte ber"
843618030085160964,"intentan apagarte porque brillas"
842207039485026306,"arbitro del DIM River"
816967523702870016,"abrazo los colegas periodista"
813650687817117696,"Love will find the way"
833060130056962049,"Tenemos carreteras"
815600541388701696,"Feliz Nuevo que pasado sirva para tener exitoso lleno felicidad siempre con bendicin Dios"
846734883699511296,"Ing Jorge Troya Director General Actualmente Registro Civil institucin insigne del"
828720698508050432,"Otro medio ahuevado que pena"
760917968930955264,"ayudo crecer ego"
774026984284262400,"Cris esta all con ellaay chicas largo llorar"
827219637955764225,"Caso Mazoyer Presidente Correa anuncia que Gobierno volver revisar caso sentenciados por supuesta"
772951524037320705,"labia que mete SURS increible"
812085175387648005,"Chicas este diciembre estar atendiendo las que deseen maquillarse tengo"
811198174916292608,"ese video del sacerdote con los nios antiguo habia salido hace como aos"
817332013652987904,"dormir ahora"
841728043194408961,"llegaste llegaste para poder soy una"
814859700932059136,"pocos das entrar Peru lujo tener Presidente"
841343006666022913,"Visin juventud sobre Participa esta encuesta tienes entre aos"
773227824090087424,"resumen Gracias todos por estar presentes vida una"
832662498100678658,"Ahora aito"
836454287949639680,"Solo baby please"
835871130233753601,"Junto Moreno lograremos una nueva victoria Votemos por futuro del Ecuador"
817038171468918784,"JUEVES OFERTA CITAS WSAAP LOCAL URDESA CENTRAL"
844411987811598336,"menos xdistnutos que empiece mircoles otro dia mas trabaj"
772970065838891008,"Faltan Das para cumple"
818189496885936129,"que hacer con cual quedarme todas cama saben maltratarme"
825088889496989701,"Cuando clase biologa esta aburrida"
823739177464373249,"cant wait for listening missing you Follow plss"
765623333144694785,"Dear your smile the most angelic thingIve ever been fortunate enough witnessWould you mind following"
826594829329108993,"Balanced Ryze"
826895192011702274,"Maestro Juan Castro Ortiz amp Orquesta Sinfnica Municipal Loja Mircoles febrero Teatro"
833399621279969281,"Cuando los payasos que estn mesa apuran mientras estoy votando"
824000412143546368,"Perfecto aplausos pie"
844601465138167808,"Family apareci martes ocupando lugar del Top las Tendencias Ecuador"
841423146674769921,"Nos encantan los Arranca semana con BUENA ENERGA favorito COMBOampm"
821193870402879488,"Voy dejarlo asmejor"
828055792330932224,"Parece que este tro est dispuesto ridculo por hasta final fin"
884633206837915648,"consultando sentencia Fujimori idea sacarnos encima necesidad pruebase puede"
831363449053642752,"INFARTOLa CONMEBOL Libertadores tiene una sensual madrina VIDEOFOTOSEST QUE ARDE"
826122276961714176,"ciudadano cumplidor las normas hay por temerle nuevo cdigo polica"
843807037716946944,"Feliz inicio semana Internacional"
832710550928891906,"Rumbo Guayas Aeropuerto Internacional Mariscal Sucre"
884533840299118594,"IGLESIA CATLICA SABE QUE NICOLS MADURO CAER RAZN PARA SOLIDARIZARSE CON PUEBLO SIEMPRE DIJE"
815262376413065216,"TonsupaEsmeraldas"
837680882987184128,"Quito Deli Quito Pichincha"
773652069471416321,"lista escuchando people mircoles mitad semana"
846852379383382016,"pensar desde las eliminatorias para Qatar valimos esta"
839670994419728384,"Las campaas los pueblos solo son dbiles cuando ella alista corazn mujer"
839674075664494592,"Que pasara luego cuando sea ciudadano comn como casi todos los ecuatorianos sin escoltas respaldo"
833710907356229634,"Una cosa acero inoxidable otros cosa hacerlo inolvidable"
821097221076713472,"las paredes hablaran muchas viejas chismosas quedaran sin trabajo"
830070063646515200,"FELIZ CUMPLEAOS DON OMAR"
764668363671007233,"LETS GET THE"
831268131410681857,"Que asqueroso"
840590186836832256,"Que joda mundo mientras estemos juntos"
766400777107673088,"Almada jug por Marcos responde con golazo Aunque fue jugada cuenta BSC comienza ubicarse ronda"
841751721416220672,"Shaky shaky"
763182017177591809,"ESTAN DESESPERADOS JAJAJA CONFIRME"
842597507897090048,"Aqu casuales casa jajajajajajaja Quito Ecuador"
836050935046615040,"Tierra bendita mis sueos donde luz primera PortoviejoRockCity"
845940727255384064,"pensar que dos das tendr que lenvantar esta hora"
821557837457485826,"Calles"
821397275851313153,"Fuerza Amarilla conocer que tendr jugadores primer equipo"
837124352705462272,"Ohhhh"
837009577744924672,"Mierda hoy primero"
847332920079425537,"Una bonita pareja youtube"
765724948400922625,"donacin las armas China agrada ser que gobierno prepara para una guerra civil"
838783905079656448,"Comunidad Saraguro Loja Ecuador"
845321430858379264,"Hctor Soldi han dispuesto buques para llevar ayuda"
836001315490791424,"Per siempre presente"
761652527305719808,"Refinera del Pacfico una opcin una necesidad para pas Ministro Poveda"
773323054466338816,"estaban muy ocupados que dieron alarma pronta por incendio Linares recien hoy entiendo que dieron por enterados"
845108363411238916,"CENTENARIAZOBrasil HUMILL Uruguay bajo atenta mirada todos sus hinchasVIDEO"
844619969035948034,"Amor para cuando photoshop solita"
838097533561778176,"SUPER FERIA TINTURADOS VIERNES SBADO TINTURADOS RAIZ PUNTASTODO LARGO"
882647722431524868,"cont todo rompi silencio brind estos detalles sobre nueva relacin amoros"
817846967384600578,"mejor compaa fsicamente idntica padre pero"
818993786919538688,"Malditos asquerosos"
765373568515510272,"Eres una mis razones para ser mejor persona MRB"
813116103010426880,"Hoy dorm pocas horas pero fue como que dieron sedante jaja que rico dorm"
817928546983284737,"Gusto Atelier Quito Pichincha"
817384898721906689,"pasado tantos aos los reyes magos siguen perdidos"
769999359555596295,"SALUDOS"
770055723971674112,"Con goles Sornoza Cortez derrot Sangolqu"
767503065444483073,"GOOOOOOOOOOOOOOOOOOOL Surez"
768238259013124096,"Beliebers Cold Water Purpose"
775914909355749376,"planeta tierra manifiesta hacemos nada para cuidarlo mientras estemos bien que los dems jodan EMPECEMOS CAMBIADO NOSOTROS"
839123852768727040,"Unamos nuestras voces concierto canto por Este Marzo las Favor"
882795377254174721,"victoria hoy grandiosa histrica pero quedan xdistnutos Sao Paulo"
821406878722883584,"RTT mejor Prenomino como Mejor Firma Firma boletos"
811550563301228544,"just finished running xdist xtime with"
883006083241062401,"Muchos pensbamos que era mentira pero verdad"
845321986830163969,"Asamblea Provincial Agraria Consejo Ciudadano Sectorial polticas intervencin ejecucin Imbabura"
840181312656941056,"Enjoy FjEg"
844171599892942848,"Buenos das gente Guayaquil Ecuador"
819694643248070657,"das cuenta que serio cuando dice Real Madrid Hoy estoy con"
828673854738460673,"Gracias por entrevista por apoyo"
819454323977547777,"Estaba una empresa dej para ser una actriz porno genial"
819739514780471301,"Vamos sorrir devagar pra ser feliz por mais tempo"
773994335935266816,"los mejores momentos son las que planifican agradecida por las grandes personas que rodean"
762401812293050368,"Vivo Gol anulado posicin adelantada cremas ataque"
821703815611219968,"Llegas una edad que solo gusta chico por manera que est viendo vida"
816885668022550528,"Dada oportunidad elegir bien solo das"
831736481928593408,"Cuuuuumbia pap"
829138839121838081,"MUDO tiembla pedir"
815001850332200960,"Como hace mucho tiempo atrs nos apurabamos llegar casa para recibir nuevo aos junto familia vamos por abrazo oso"
843223483316404226,"Quisiera que pudieran oler esta pata chancho"
820090052000776194,"Con Ministr del Interior JOS SERRANO Duran City"
833717747469189120,"pueblo ecuatoriano cojudo seor cuidado fraude"
770444044136747013,"dabas los buenos das nos escribamos por mensaje texto"
815998460042346496,"The importance using nearly isogenic lines closest isogenic lines"
826178686214774784,"estimado deseo hacerle una consultasigame por favor"
883885401852825600,"Septiembre llega"
836350834615144448,"comer Cdla Abril Manta"
832680348496515072,"Maana diario Exitosa APDAYC publicar suplemento alusivo sus aos fundacin Detalles fundaci"
769717823736254464,"ahora una tendencia"
844739867892469762,"tristeza tiene nombre"
838022704045436929,"Polica Nacional interviene ocho sujetos involucrados diversos delitos"
884097731144429569,"Adivinen los nombres los aspirantes Contralor Alianza Pas para eso mejor que vuelva Plit mismo saco lista"
843927146804514816,"CAMISETAZO Figura del Atltico Madrid descarta vestir merengue blaugrana"
883485057364758530,"Por parte comunidad Deleg solicita alcalde Dario Tito tomar cartas Asunto para prevenir"
830096918394966018,"Guayaquil Ecuador"
811702250259304448,"Este fue con cambios toda vida"
831277975140188160,"Los Cangrejos Pepe Loza"
826779768356012032,"desde cabina acabamos llegar donde con tuvimos una gran acogida"
777522468625977344,"Economista Felipe Argote destaca que plata del Canal misma toda"
825158438598615040,"Gol del Municipal IDV Municipal con ese gol clasifica equipo peruano"
833506695326396417,"Esto"
765728540952236032,"las Todo sobre caso nueva vctima del maltrato contra mujer estilo por"
773369096029278208,"tiro libro fue por achilier Asi que"
840398644230610945,"Out Darkness Into LightTRUE STORIES CONVERT MUSLIMS CHRISTon Amazon KindleClick HERE"
830661762361999360,"sorprende que han dicho que Correa prefiere hasta extranjeras que mujeres ecuatorianas porque cas con una europea"
834551588337381376,"permitiremos atropellos voluntad del pueblo debe respetarse exigimos proceso transpare"
766471241989365760,"vita amor"
828775068549468160,"sorry pero jams copio presentacin fue inspiracin hacia Michael Jackson Djate cosas Ella conoce"
777353907207102465,"tambin jajaja"
882575608269721600,"Pura Verdad"
766348761312403457,"pero decisin responder asi que haga tilza ella pudo decidir responder fue eleccion"
812506633603600385,"bonito hacer nuevas amistades pero mejor conservar las viejas"
839510977787879424,"Hoy todos debemos alabar admirar creacin mas hermosa espectacular del mundo Godoy Cruz Amrica"
822252423662211074,"pregunto Quin pag cadena matraca dan gratis los minutos"
824951333287505920,"estos aos gobernamos enfrentamos los problemas funcin del bien comn ciertos grupos"
824836721170907136,"Estupidas fotos que cargan"
835949200168865792,"Nos reportan congestionada para llegar Carnaval Chota"
828702402270359552,"Los mismos que sealaban hazaa que esta gente hacia los estadios hoy tiran lavan las manos"
838614706424283136,"Sin apoyo"
830421148236148741,"Candidatos que vivimos Sur pertenecemos Sur somos del Sur"
776970188218589184,"Huele empate ltima dcima segundo"
829396396658872326,"Sbado White Party Ven farrear brillar toda noche con nosotros como"
841464467913396224,"encontr familiares cercanos nmina los servidores pblicos"
834826615678984192,"Frente las agresiones ciudad democracia"
836020231453741056,"jueguen con agua puerca rasquia les puede dar Como Vito han quedar"
816319989527367681,"acaba convertirse ocupando posicin Ecuador"
827867252330463232,"Casa Blanca reaccion con dureza decisin del magistrado tildarla indignante"
835877518716583936,"Agricultores provincia punea Sandia exportan papayita andina"
822535574036901889,"jueguen eggwars trolea noni mucho"
846577430370365441,"Jajaja dilema"
817322562464129024,"LLuviesita pap para agro"
846839117812027397,"IMPORTANTE Recintos electorales New York New Jersey Acude sufragar"
819692273428480001,"Obama pone fin poltica pies secos pies mojados"
820112525874393091,"siempre bella"
842185526023204871,"Conocerlos mas hermosoAmo todo ellossus canciones xdist sueo abrazarlosdecirle que los amo"
764500427345977349,"ESTAFA FUERA UNA MODALIDAD OLMPICA ECUADOR TENDRA DIGNOS REPRESENTANTES Brasil"
834954478826708992,"somos personas perfectas pero somos personas nicas"
842162561684520960,"Conocerlos mas hermosoAmo todo ellossus canciones xdist sueo abrazarlosdecirle que los amo"
825492719212646400,"Noche tekila dicen"
