"id","text_only"
763393484619386880,"Aunque ande valle sombra muerteNo temer mal alguno porque estars conmigoSalmos"
767194522828832768,"Los mejores MiVotoEsPor"
883383457908477952,"Mejor toca rernos poco"
833564283447365632,"Camin militar siendo impedido por gente porque ingresar los exteriores del CNE"
814227445775814656,"Dilemas apuestas reflexiones tericometodolgicas Historia Reciente"
813028606851026944,"Alistndose Para Prosecion del voy con amarilla como pasado"
765394005114941440,"JAJAJAJJAAJAJA"
839879345426599937,"debo reconocer que blanco negro siempre sern dos colores que pasan moda"
818153825248968704,"mejor Ceviches Pescado Curtido Camaron Risotto Mas Pidelo Domicilio"
823243694446903297,"participamos mesa seguridad con personal para evaluacin"
830989149868007424,"por favor sugieran ustedes que cambien ese baln"
825347094433120256,"ECUADOR presente con nuetra representante apoyar con Twitter"
777874941291143169,"Con construccin del puente sitio Morro del cantn Bolvar mejorar conectividad zona"
884864333582397441,"accionfuturo with"
819311211070140416,"famoso Riviera con mis papis Dia las Madres que bueno esa vez estuvo"
844658360565841922,"Viviendas carreteras son las afectadas por intensas"
764246724663734272,"ATENCINEl informa fluencia vehicular Costa"
767869005365383170,"LARRY"
811634107247640577,"pasan oye Mucho ruido por cinco milloncitos Como pueden dudar nuestra excelentsima"
764498634662608896,"ideologa gnero afirma que nadie varn mujer sino todos son gnero Muchos creen vez mofarse"
832277899399069698,"Consejo Seguridad Ciudadana presidido por alcalde posesion Amaro Robles"
822416138202181632,"Que ngel hermoso del cielo ciude tus pasos cada estrella refleje belleza corazn"
774811964958801920,"Simplemente esos das que nada entiendes"
826944128344690688,"Caso Petroecuador Para Procuradura haba fundamento jurdico para suspender audiencia Alex"
775839628104466432,"ANDAS DESAPARECIDO"
825122730299232256,"IDVMUN juegos son los nicos equipos ecuatorianos invictos como locales jugando por Copa Libertadores"
844668584987123712,"Convierte los muros que aparecen vida peldaos hacia tus objetivos"
766319124364529664,"BSC juega oportunidad para pasar segunda ronda Copa Sudamericana Zamora disfrtalo por Fox Sports"
778059063758290944,"Creo que estudie mucho por hoy dedicar horas ver las series que visto hace meses"
842498707618775044,"Escuchas con Ahora"
831341177001635840,"Jajajajajajaja"
819256947207786496,"ponen arreglar calle los laureles plena lluvia congestion Cierran calle sin avisar Que eficacia"
829100800811077632,"enseanza que deja huella que hace cabeza cabeza sino corazn corazn"
767164961156202497,"Voto por LeDanPlay Gracias"
768305698937511936,"Shi pero fue"
811379618922057732,"Time set back fighting week long Upper Respiratory thing"
831238781315342336,"Creador Hola Mauricio deber pagar salarios bsicos Canal Uno recibi llamado atencin"
814295204694028290,"Cooking Santo Domingo los Tschilas Province"
763361736443498497,"Costa presentar sulfatado pantalla tiene mala calidad darn Gta"
762526703029723136,"Con labia barata jaja mejor vallase otro lado"
845428525133955072,"tengo que rendirme puedo permitir que los obstculos estanquen vida"
812423253834813441,"estoy haciendo spoiler sola"
762319523940794369,"Tengo amor sincero amor del bueno"
834911547990372357,"Muy pronto nuestro mtodo llega televisin para Amrica Latina mano nuestro progra"
834247632092553217,"chicas lig Juanpa"
883343070170943488,"verdad esta quedara hasta Nov Dic volver una vez que termine las Eliminatorias"
846955428198174720,"Just posted photo Guayaquil Ecuador"
828356194305716224,"xito efecto acumulado hbitos insignificantes Raimon Sams"
824423288185225218,"miembro del DNC compaa del Asesor Jurdico Amadeo Delgado Rivera oficializando pendn"
836018627707027456,"Como estar mala esta versin los que una pelcula cmo est nominada mayora premios"
846388701395595264,"Restrepo Entre presupuesto destinado Educacin Ecuador triplic xdistllones"
846927288331632640,"estamos"
843646384544907266,"Balsapamba Bolivar Ecuador"
847244077301080067,"Puerto Lpez"
761751307749302272,"Daz viniste para hacernos campen"
846108998294290433,"Impresionante los pases los jugadores Liga Como dice tres pases seguidos"
836612007457665024,"GRAA MONTERO QUE PASARA Hoy hay mucho juego"
883518453054717952,"stefanycamachog getrepostMi look hoy maravilloso gracias"
822203912887353344,"Las obras siempre hay que hacerlas bien completas rpido"
770467609485672448,"Ojala encuentre nuevo para estar preparada con balde por las babas"
842952814288670720,"Cuando abuelita acuerda del nombre algn seor dice Don Cinforoso"
830889206083878915,"BSC todava aceita maquina est duro hoy tiene para jugar esa cancha"
817430835380961280,"Ecuador soporta perodo altos niveles lluvia"
837371878616481796,"iniciarn este domingo campaa limpieza del"
827616535241949184,"Sin comentarios jajajaja"
819656527137083392,"Caja para info"
842846906279636992,"Aqu esperando respuesta pasado que jams existi"
811720378108301313,"Enserio Cul almuerzo Que salio Programa Radio"
838855557985488896,"Hoy voy estar tan activatal vez maana tampocoNo"
843320361739608064,"Que rico"
815357653367083009,"fin contamos cuantos los nuestros siguen vivos con nosotros celebramos nuestra buena"
834845710252130304,"FIREPORTDJ CARLOS PALACIOS PIROTECNIA FRA IDEAL PARA MATRIMONIOS QUINCEAERAS SHOWS"
826869490436734977,"sigan puse algunos artistas que gustan"
829097909094342658,"Quizs para eso este con otro acariciando piel"
824643118892978176,"mejor para limpiar los chicos despus playa una ducha porttil solo"
836483386755678208,"Feriado CLUB"
765067913950879744,"amor vida constante hay otras nalgonas"
767741207736877057,"Lengua Spanish School amp ToursStudy with one hour one week one month one year"
833453162363285504,"costa existe patriotismo"
883273563268100096,"Viernes que quiero Viernes"
882976165597761537,"hermoso esto"
833564697584685057,"Los VOTOS SIN CUSTODIA MILITAR pas levanta llevan cabo Fraude"
770475105990434817,"Change your mind"
828686785823834112,"importa cuanto haya costado cuanto hayas esforzado cuanto hayas sufrido final unidad medida justa"
824834697163337728,"Seguir confiando DIOS"
846088273181265920,"coordina atencin con para accidente trnsito Eleodoro Solrzano Guayaquil"
815189947703525376,"HOY dic SOLO DIAS Que las URNAS marquen ECU TERMINACIN del PODER OMNMODO que histricamente engendra CORRUPCIN"
765532210078384128,"gusta Pues encantas prncipe"
847087769541361664,"Importante evite construir casa pendientes quebradas sitios cercanos ros"
767910278705143808,"Solo xdistnutos contigo aqui Ecuador con club"
883017684677480448,"Just posted photo Comit del Pueblo"
778003513968328705,"Just posted photo Man Las Cascadas"
773906074680209409,"Prepara deliciosa papilla camote con melocotn albaricoques"
766425066561212417,"Cuarto penal Velasco cobra ataja arquero"
840593736400809984,"Compaeros cero tolerancia las invasiones"
884856865590571009,"octubre Jajaja"
774818334672060417,"Renata"
812901862177439745,"bebe les desea una feliz Navidad Guayaquil Ecuador"
827705944482127873,"duelos perdi como local por Olimpia aos sin xitos Ecuador"
845635876159938561,"Con una maana soleadaen Libertad saludamos nuestro seguidores excelente"
847197386950758402,"Siempre que escucho Cerati nostalgia enserio sufr con enfermedad luego muerte"
811907686891655168,"Copa Libertadores integra GRUPO"
777735870531178496,"Hoy entrevista dijeron Dime defecto que respond Soy enojona entrevistadorCOMO TODAS LAS MUJERES"
769659377318068224,"Clmaco Caarte Luciano Macas Vicente Lecaro Washington Muoz figuras del ftbol Interbarrial"
816394448426831872,"empieza ser Tendencia con tweets ocupando posicin Ecuador"
884958706617782272,"brinda informacin"
774275664480464896,"Org Animalistas frente engaoso comunicado"
767857981014806528,"Cul propuesta haras sobrepasaria las hasta ahora hecho mal bien Nebot tiempo"
816766151418118146,"Jajajajajajajajajajajaja"
827115273945804800,"Hoy celebramos Mundial los Humedales son fuentes regulacin abastecimiento hidrolgico"
829108777039323143,"Los aspirantes Combatientes recibieron visita los DTs Quines clasifica"
811745445634568193,"Grupo muerte toco est grupo con"
819005965064433671,"Pocas horas"
884999937573965830,"consigue importante espaldarazo para proyecto"
838614568175878144,"Sin apoyo emocional"
840258099101499393,"solo Meet and greed"
840962004319907840,"ALINEACION NACIONAL Crdenas Montao Quionez Guerra Segovia Larrea Noboa Balda Muoz Jess Quintero"
814507508433821696,"Puedes engaar algunas personas todo tiempo todas las personas por tiempo Pero puedes engaar todos todo tiempo"
817712528008560640,"Bello para trabajar all vamos demostrar que tenemos voluntad para servir Feliz Sbado"
836205889384218624,"Damnificados del terremoto quisieran tener depar como los Correa don con Cuba Viven carpas"
831496255029260288,"Hoy todos van poner cursis las redes"
816386641132748800,"Just posted photo Hospital Luis Vernaza"
826401560850726912,"que lugar hora dar conocer plan socios piensan seguir sin rendir cuentas"
776765784391581696,"Cada locura por amor"
839219344685084673,"fue Napoli"
832820934318911488,"Hacete coger por Americo Vieja chichera"
841810918849826816,"Soy una moneda fuentet deseo pendientemis ganas revivir"
820621607253188608,"ENTREVISTAEstamos tratando adaptarnos que nos pide Marcelo jugar con tres abajo Jonatan Maidana"
884420617679892482,"Cambodian temple complex listed world heritage site Bangkok Post"
840332766315204608,"estado cruz pamba Celica con derrumbes"
773306722731565056,"Watch Matthew new video Like and subscribeTE AMO ANGELx"
835719830623895552,"GRACIAS VIAAAA FUISTE INCREIBLEEE"
763237449959141376,"sin soy como preso narco extraditado"
827267329725575170,"Llueve que llueve"
763117333804122114,"fue hroe con Atltico Madrid ahora con Sevilla"
834114143829520385,"tweets porque juanpa cool"
832360269783371776,"Romina Romero coaching quita los velos para encontrar esencia"
820064245140357121,"Tbckg"
829465838893821952,"mejor lugar mundo Parte atrs"
832429376901959680,"Los Cangrejos Pepe Loza"
777536629065920513,"Excelente trabajo nena angymirandagarcia with repostapp"
838584304347328512,"Todas las mujeres like"
846561984158027776,"Decir que adivinen edad que siempre respondan serio tengo aos"
833488348320845826,"Desde hace rato tendencia Lasso baja manera sospechosa"
827858137344532480,"mueve montaas"
769634187636830209,"Amo clculo cmo pude desligarme los nmeros por largo tiempo"
838930921285959682,"ahora una tendencia"
776166470464208896,"Maana Primer Encuentro por Educacin Buen Vivir Les Esperamos"
820747505994498049,"Pascuales City"
821099806546427904,"Una nuestras herramientas reconocer que somos dbiles Dios perfecciona ellas"
825368914460827649,"hola ximena"
816868970955476992,"Son brutos"
813155616533475328,"indiferencia mata"
838764291146854401,"capaz que voy extraar unas semanas lpm"
824293158767001600,"Todos tus tratamientos puedes pagar con tarjeta crdito favorita Centro Guayaquil"
844677183096475653,"Faltan das para fiesta que viviremos"
814705126086680578,"que momento habla mas pendejadas sobria estado patologico"
816020221295202307,"solanooadrian adriansolanoo Los Ros"
767131203166232576,"AMO CUANDO CONVENCES"
838599508283969536,"supero genial est foto gracias"
761909451523784704,"terminar jornada laboral nada mejor que hacerlo con una buena cancin"
774794048519503873,"Morgan fue como estrella pero quien sido corazn del equipo"
830080089400434690,"Psiquiatria Hospital Del IESS Teodoro Maldonado Carbo"
832364139515375618,"Vamos con fuerza vamos por"
840793675730939905,"Hoy provincia sali respaldar nuestro presidente desde gracias mil gracias por ese res"
777705944344133633,"pregunto Facebook tambin recuerda sus palabras vanas"
884455406369619968,"Celebrando del comerciante desde Baha Malecn"
845853802779590656,"TIJERAS CON MELI PULLAS COCA ENTRE SHYRIS PARS EDIF AMARILLO"
774337834710806532,"BUEN CORTE CABELLO HABLA MUCHO pero Djate asesorar por profesionales"
813132679222882304,"pasan este partido FELIZ NAVIDAD"
884459876239499264,"Guayaquil vivimos entre bestialidad bestialidad funcionarios municipales que creen"
830553611285491716,"Just posted video Playas Villamil"
845874668582055936,"Quito Ecuador"
839105632607350787,"Por los celos Mara Juan fue"
839153173633904641,"Salmo Dichoso que agarre tus pequeos los estrelle contra las rocas"
839182279243149312,"Quisiera ayuda con una denuncia esto una falta respeto ese terreno est"
839196251614810113,"Ojo piojo caballeros"
839233894180356097,"Lenin fue creado para hacerme enojar cada xdistnutos"
839295281489408000,"Estimado Lenin porque hija luz las Extraordinarias clnicas del Iess como del Guasmo"
839829882309836801,"Que grave"
839882873893187585,"lugar para visitar Cuenca"
839901435999432704,"Visitando comadre Meche Guasmo"
837793213947777024,"Esta prueba clara que modelo econmico sostenible Menos empresas Menos empleo"
839630507507855360,"Enserio opina esto los lderes indgenas respaldndolo Que paso"
839970707853479938,"Comienzaaaa Wigetta Extremo Preparadoooos Like"
839889268591980545,"Acurdense que este encapuchado fue APe infiltrado las marchas para acusar violenta oposicin"
840082460616548353,"Con esa ropa desnuda quiero Sorry"
840008229237202949,"Jajaja tambin perdi todos sus libros contables millonario muy distrado"
840190676092497921,"Crece alarma poblacin ante crecida del caudal del Piura teme que las intensas lluvias provoquen"
840247386589007878,"BITCH"
840259919785934848,"ICANTGETOVER THIS SHOOTSOMEONESENDHELP"
840262292440674304,"what guys think the video shot Miami was sooooo much fun"
839945486954033153,"Criminales del cubano alojados aposentos presidenciales Carondelet preparan medidas seguridad prxima llegada Ral Castro Quito"
840293517989675009,"HOY NOS VEMOS ESTA NOCHE"
840321730363195396,"PPK asegura que permitir tener ingresos familias"
840319756003614721,"Contralora Regional alerta sobre presuntos pagos por derecho carpeta"
840961694906122241,"Buen gol Blackburn marc bien lnea pase coloca segundo palo baln"
840063956446150656,"Aprobeeeeeeeeeeeeeeeeeeeeeeeeeeeeeeeeeeeeeeeeee"
840738243876392960,"Compartiendo con todos Recreo"
838848469376909312,"Zaruma est peligro Valo hoy las"
841121846749777920,"que hace hacer"
841283226534576128,"Buenos das Comienza semana content sin estrs"
840064939297447938,"Necesitas mucho dinero sentimientos todas esas tonteras"
841291240490565632,"Copien rpido que voy borrar pizarra"
841420157092282368,"las papas son marte"
837753199188721669,"equipo del feminismo gourmetizquierda caviar"
841481673237811200,"Creo que comenzare trabajar denuevo"
841460783708028928,"Vitochada Vizcarra deja mal parado Ejecutivo por eso creo que presidente debe sacarlo cncer par"
842033750649237506,"BUENO ICONO MAS PARA ESPERO QUE GSUTE"
842072634397470723,"LOOOVE her version she has seexy voice and amazing range love the way she whispered some notes"
842085308753707017,"Lanzamos campaa LIMPIANDO TECHOS para prevenir los focos infecciosos por acumulacin agua por las lluvias"
842061647351033859,"Mientras que dan con palo los Panamericanos desde Chile llegan mensajes apoyo Para reflexin"
842192083368599552,"Estamos organizados listos para atender emergencia Mantengamos calma obedezcamos las autoridades"
842061305917935616,"Estoy orgulloso Dayro Moreno todo gamn sicarial hace parte Familia SDVSF Cunto gans"
842595574352363520,"Tbt"
842741446557995011,"Indiga leer crticas maliciosas puado ociosos mientras miles PNP juegan vida gobierno llega"
842785660952104961,"CELO DIO FAV AAAAAAAAAAAAAAAAAAAAAAAAAAAAAAAA"
842844155739029504,"Remember when asked for pictures This what did"
842427926775750656,"estoy celosa"
843118203224186881,"los juicios Filanbanco son mismo restamos los amiwis Empagram del Fiscal Fuente Sigob"
843161645631373314,"Restriccin agua continuar hasta las Lima CallaoSe cumplira Gracias"
843205224248610816,"Llapingacho con ensalada veteraba mezcla tan malditano puede ser"
843152139748855808,"Cruce Kunturwasi Deterioro Carretera CajamarcaSan Pablo Podra dejar"
843268044663283712,"Por audios limeos rompen tuberas estn borde del saqueo Imagnense vinieran empresas mineras quedarse con agua Feo"
843260952443346945,"ustedes fueran Donde prefieren alentar"
843685941994766337,"JAJAJAJAJAJAJAA mention Francis"
843697316469137412,"Casi voy pito con Moreno JAJAJAJA"
843835310391877634,"Hula voy grabar preguntas respuestas dejo ltimo para que dejis comentarios con alguna pregunta"
843636098584793088,"comparto con toda buena intencin tuit joven desaparecido aparece los das deberan explicar que pas realidad"
843869424868376577,"VOY HACER GRUPO WHATSAPP envenme sus nmeros por Los quiero"
843889769184706560,"Sobbing tears what have women done beautiful franchise"
843955801580560384,"cierto uno tiene trabajar pero que fuera nico canal Sea"
843892580177842177,"muy mal que con fin ganar protagonismo pone criticon Que suerte que mayoria"
843887469045174272,"cant wait septiembre"
843990764841582593,"Hoy estaba peleando conmigo misma porque dejo que crezcan las uas"
844003601647353857,"quiero que tus ojos miren que tus labios"
844010823613730816,"Cray"
844039895207362560,"Nadie gana Seungri fuera bromas fuera real necesitaria tratamiento dinero habria evapor"
844047324405993472,"apparition"
843998888931606528,"saludo dos grandes que vinimos"
844217860465606657,"aos olvidamos Feriado Bancario quienes fueron sus autores Recordar tarea todo pueblo"
843944952648351745,"pasa que cuando canto ingls pronuncio joya pero cuando tengo que mantener una conversacin hablo como viviera una caverna"
844292767593484288,"Valenta como sinnimo hombra despus dicen que vivimos una sociedad machista"
844262929767776256,"Esta podramos ser viendo"
830535936614264832,"dear friends"
844352048149774336,"VIVO mayora personas que han perdido sus casas porque construyeron malos sitios"
844274131604574212,"Gracias PPK Per queda como Pas corruptos entrevista cadena Intlse olvida est involucrado inv"
844911510946230272,"Hoy que logramos entrar hotel que Abraham hospedaba Pedimos habitaciones por noche"
844994751690653696,"Prioriza uso gel desinfectante para limpieza manos"
844583429182296066,"Forsur Pisco los apristas que son apristas que caen por corrupcin Hay que tener cara bien dura"
845100442170351617,"viene"
845126325497094148,"Voy quedarme despierta hasta las esperar sale video barco papel Igual maana estudio que mas"
845171887705534464,"Uuppsss Alguien despert"
845245857100419072,"current issue MEA that dont know who romance like Wish had that problem irl huh"
845345580704563201,"Sin duda uno los mejores lugares para almorzar mercado iaquito"
845432173633191938,"Dada nueva moda politiquera lunes primera hora notarizo que lunes que hace para huir simple debate ideas fin"
845167929796681728,"renegar har mal"
760870472758231040,"fellow members the otter fan club like introduce you other"
760874515156967424,"yrs ago you didnt see companies get involved social injustice issues amp today see that like with marriage equality"
760908770671198209,"Lanaro Maripan Ayuda Comandante decidir envia mensaje voz whatsapp saldrs aire"
760209576201490432,"Shavos aiudan con para banner del buen hombre"
761244302219632640,"Explica Ines Condori preocupacin tristeza por pretensin dejar impune delito lesa humanidad"
761292586313195520,"QUIEN LLEVAR PARA GANARME ESOS jajajaja"
761301992690049025,"Estn listos chicos"
761303569505120256,"Porque mejor siempre mejor mejor que nadie"
761265899722637312,"pan nuestro cada DIVERSOS PLANETAS REDEDOR DEL MUNDO Jorge GLas"
761363518507450372,"Hay una nia que cree Harley Quinn premier demonios tienen cabeza para querer ser ella"
761376102556327936,"Pumas saltando Pumas saltando"
761380428943089665,"TIENE CULPA COMO DEJAR SOLA ENCIMA CAMBIA LOOK APUESTO ERICK AUN JAJAJAJAJJAJAJAJA"
761350014471811072,"Lasso invita Yasunidos buscar soluciones los problemas ambientalesNoticia completagt"
761546488216510464,"chico inteligente debera ser soberbio machista femiradar detectara dictaminara NEEEEEEXT"
761379190272880640,"Quin necesita drogas duras cuando hay salchicha Tulip con galleta soda"
761592693894053888,"Universidad Santa Mara seguir abierta hizo justicia confirm confianza comunidad universitaria"
761647152573534208,"Duela quien duela son mejor programa espectculos Que sigan los xitos para ustedes"
760619942735732737,"Amor pasaste que buen desayuno"
761411850584162304,"What you think you become What you feel you attractWhat you imagine you createBuddha"
761721947218644993,"mientras veo ceremonia creo que tambien voy paseo Espaa como Tini quiero hacer amigos por alla"
761709487245889536,"alguna vez les cont primer amor pero fue paquete completo amor decepcinrecordar volver vivir"
761221915885395968,"Los fujimoristas estn competencia para ver quien escribe tuit idiota vergonzoso"
761916934497665024,"Segundo fin semana madrugando pero ella Feliz Campamento UCA"
756722526424854528,"incremento del IVA por terremoto fue dar Manejo Integrado Liquidez del Sector Pblico"
761983324285984772,"Pero que esto"
761893598837301252,"ltimo clase sbado por fin"
762282175735615492,"Joven aos asesinada golpes por pareja VIDEO"
762294503101308928,"NEW Vlog est today Destroying the cop car LIVE est today Lets this Going HUGE"
760523396723666944,"Gob Nacionalista implement registro vctimas esterilizaciones forzadas Sorprende que archive Fiscala"
761740839554912257,"simple opposite leaves intrapetiolar stipule ovary inferior flowers often showy amp scented"
762386038698409985,"pasado oscuro Bonnie JAJAJAJAJAJJA"
762386159754420224,"mentira cuando encuentra con realidad quiere ser verdad eso tambin somos ramos"
762423064533413889,"equipo pura garra pura voluntad pero serio desesperante mal que juega mal que marca"
757758316600758272,"Hoy empepes que tocamosTranca"
762493053466619904,"igual quiero una mejor amiga"
762489473590439936,"Otra vez este pendejo"
763066590644559873,"acercan las vacaciones dejen darme malas noticias destino hacen tener miedo"
763412358953861120,"Acabo usar que estoy saliendo con alguien"
763419242029023232,"Neisi Dajomes gan grupo esperar grupo esperar sus queden mejores puestos"
763486086022791168,"Padrastro vecino nia asesinada Caete son sospechosos del crimen"
763449784275439616,"gorditoooo con cualquiera las ser feliz"
763503213567938560,"Good evening girls"
763514401966075904,"Mixtape The Boss Impression"
763383922852032518,"Crticas enemigos nombramiento Martha Chvez como asesora vienen del temor una gran profesional fujimorista leal experimentada"
763551465520717824,"forgot had test tomorrow about redox"
763449290068897792,"Hoy escucharan muchos gritos honor grito independencia jajaa"
763616811589967872,"escapas con Maluma"
762705505437581317,"Ampliacion del contrato Arias muestra confianza tiene Neme proyecto nuevo uruguayo indicado para llevarlo"
763540778664665088,"Trato Recargar TAG sistema veces este resultado funciona habiliten"
763788626652168192,"Muerooooo DIVINA"
761254550670086148,"hola hermosa estado llamando para concretar una cita ver donde ubicas respondeme para coordinar gracias"
763916861968822272,"presentaron dos deuncias contra Cordera por apologa del delito"
763953380699967488,"Hoy por una medallacon gran amigopersiguiendo una ilusin dejo pensar todos los desde siempre cont"
764143877255204864,"Estas buscando google"
764208286178697216,"Weird that Revealed didnt post the artwork"
642858517477609472,"TERMINO DISCAPACIDAD JUSTO DIGNO CIERTO UBIQUENSE ASUMAN RESPONSABLEMENTE TAL REFLEXION"
764291727574302721,"Tener maana clases Dios"
764297671414804480,"seguire adm empresa derecho que hago dibujando sistema respiratorio"
764297745377132548,"Siii pierda bailar con rfaga"
764298279228145665,"Que lindos una foto waao lindos paro repetie jaja bellos"
764488775892369409,"Abrahamers MADRID Nos vemos MAANA por noche concierto que dar LEGANS Preparaos porque vamos liar"
764290914152017920,"repudio total esta escoria has regalado gusta esas pginas deberas sentirte avergonzado"
764614377752317952,"Gente que respeta privacidad agarra pedo"
764644575671705602,"Judoca resultado era esperado pero estoy contenta con nivel"
764916043882045440,"Ayer inauguracin nueva marca ropa con toda gente Santa Anita"
765009876527439872,"Recuerdo GonzalezPrada parece que seguimos con eso donde aprieta dedo surge pusMejor sigo con"
765016189848391680,"ganaste reino los cielos gracias por cargador"
765021678552440832,"cuntos pierden manos pies"
765030792267460609,"equipo barriodonde los amigos juntan par horas antes salen jugar QUE SALGAeso este equipo profesional"
765066204423852032,"feliz cumpleaos brother abrazos gol distancia"
765174191494729728,"Antonio Valencia jug partido candidato mejor jugador con Manchester United"
765153190094471168,"Ahora instalada Villa Olmpica Vamos con todo Arriba Per"
765227319401259009,"definicin"
765255350232678401,"taquilla USA una basura jaja dije Warner estabas mal visin del film taquilla razn jaja"
765269233227984896,"Sin pelear jaja entonces vamos aprender como deca bolillo Porq investiga mejor quien puede quien filtro"
765295691111493632,"ayuden con aburrimiento denle"
765290167502565376,"Rosquitas sal hechas lea queso Montecristi como mata hambre"
765392742839119872,"Como vivir tanto Fidel Castro durante toda vida comido ningn cubano vida probado"
765623903477694465,"ERES YISUS CUANDO DIJISTE QUE SUFRA MUCHAS NAUSEAS DIJE SERA ELLA AQUI ESTAS"
765376948440821761,"les deben dar slo pensin resto"
765731944114057216,"VIDEO EsSalud Contralora debe confirmar denuncia Shirley Melndez"
765749207693160448,"Ahora bien Arn ordena equipo bast insistir con Vargas que ahora hace con Bulos orden"
765211136501411840,"Acaban proponerle matrimonio una atleta China los olmpicos siquiera invitan chocolate Vida triste"
763589003220230144,"Bienvenido Per apoyamos lucha los demcratas por una Libre"
765964117500985344,"Hilo sobre que Dalas dice vdeo"
